Query,Date,user,Tweet,Img_present,Likes,commnets,retweet,tags,mentions,url_count,length,cosine_similarity(%)
pulitzer,7:03 pm · 26 Apr 2020,Ben White@morningmoneyben,"When referring to Pulitzer PrizesQuote TweetBrian Stelter@brianstelter · 26 Apr54,000 dead, and he went on a misspelled rant about ""Noble Prizes."" https://twitter.com/brianstelter/status/1254450162774269953…1129126",0,126,11,29,,,0,214
pulitzer,7:01 pm · 26 Apr 2020,Amélie E. Koran@webjedi,"First... it's ""Nobel"" as in ""Nobel Prize""... 
Second... generally journalism's top prize is the Pulitzer...

Then again he touted an unproven anti-malaria drug, suggested injecting disinfectants, and generally is not who we need leading us through this crisis.

#SorryNotSorry37",1,7,3,,#SorryNotSorry,,0,278
pulitzer,7:00 pm · 26 Apr 2020,Tom Nast@Montco_Nast_Tom,"It’s Nobel, not Noble. And he means Pulitzer.",1,,,,,,0,45
pulitzer,6:52 pm · 26 Apr 2020,Jason Smith@JasonSmithRadio,"1. He meant Pulitzer

2. He spelled “Nobel” wrong. 1",0,1,,,,,0,52
pulitzer,6:51 pm · 26 Apr 2020,Ron Garza@RonJohnOnline,"The last journalist who won a Nobel Prize in Literature was Belarusian investigative reporter Svetlana Alexandrovna Alexievich in 2015.

Trump is confusing the Pulitzer prize with the ""Noble"" prize. Very, very badly.2919",1,19,2,9,,,0,220
pulitzer,6:50 pm · 26 Apr 2020,The Voice From Beyond@NeroTulipLives,"I mean, where do you even start with this? Misspelling ‘Nobel’, or having confused it with ‘Pulitzer’, or threatening to sue the Press? The #WhinerInChief is losing it.",1,,,,#WhinerInChief,,0,168
pulitzer,6:44 pm · 26 Apr 2020,John G Hertzler@JGHertzler,"Replying to @realDonaldTrumpI’m pretty sure you meant the PULITZER.......not the NOBEL. But it was a noble, yet failed effort to insult #TrumpIsALaughingStock110",0,10,1,,#TrumpIsALaughingStock,@realDonaldTrump,0,161
pulitzer,6:44 pm · 26 Apr 2020,Markus Feldenkirchen@MFeldenkirchen,Replying to @realDonaldTrumpThere‘s no „Noble Price“ for journalism. Did you mean „Pulitzer“? #fakenews47116,0,116,4,7,#fakenews,@realDonaldTrump,0,108
pulitzer,6:43 pm · 26 Apr 2020,AJ@baconmcnuggets,"1) No such thing as a Noble Prize.
2) The NOBEL Prize isn’t awarded for journalism. 
3) He probably means Pulitzer?
4) This President is an idiot.215",1,5,2,1,,,0,149
pulitzer,6:43 pm · 26 Apr 2020,Roald Oines@Rfoines,"Replying to @gtconway3dIf he can't spell ""Nobel"" how's he going to write ""Pulitzer?""3889687",0,687,38,89,,@gtconway3d,0,91
pulitzer,6:56 pm · 26 Apr 2020,Mrs C@MsC1889,"Replying to @realDonaldTrumpImagine being so stupid you don't know the difference between Pulitzer and Nobel Peace prizes....

Stable genius hey?  #MyCatHasMoreIntelligence2",0,2,,,#MyCatHasMoreIntelligence,@realDonaldTrump,0,173
pulitzer,6:55 pm · 26 Apr 2020,avi scharf@avischarf,"What. the. fuck. are. you. talking. about?

It's called the Pulitzer
(and you misspelled Nobel)1213",1,13,1,2,,,0,99
pulitzer,6:54 pm · 26 Apr 2020, grasonas @grasonas,The *Pulitzer Prize (not that he’d know the difference )Quote TweetKyle Griffin@kylegriffin1 · 26 AprThe *Nobel Prize15,0,5,,1,,,0,119
pulitzer,6:54 pm · 26 Apr 2020,Grant LaFleche@GrantRants,So who wants to tell Trump that American journalists can win the Pulitzer Prize not the Nobel Prize?15751,1,51,15,7,,,0,105
pulitzer,6:54 pm · 26 Apr 2020,Bongmaster Exotic@jerweber,“Noble” Prize and a Pulitzer — same difference512,0,12,5,,,,0,49
pulitzer,6:53 pm · 26 Apr 2020,Linda McGough@mc_gough,"Replying to @realDonaldTrumpPulitzer? Does he mean Pulitzer? Is he locked in his bathroom? Can't somebody get to him, put him down for a nap?1",0,1,,,,@realDonaldTrump,0,142
pulitzer,6:52 pm · 26 Apr 2020,Leslie@diatribestress,"Replying to @realDonaldTrumpSo, journalists get ""Pulitzer"" prizes, not Nobel, which you misspelled. But I'm sure all these mistakes aren't mistakes. Just sarcasm. Right?422267",0,267,4,22,,@realDonaldTrump,0,175
pulitzer,6:50 pm · 26 Apr 2020,“What if Obama...?” Event Horizon@44EventHorizon,"Replying to @realDonaldTrumpIt’s called the Pulitzer Prize, you putz. Also, it’s spelled “Nobel” not “Noble.” #TrumpIsALaughingStock",0,,,,#TrumpIsALaughingStock,@realDonaldTrump,0,132
pulitzer,6:46 pm · 26 Apr 2020,Jarrett Bellini@JarrettBellini,"Noble = Nobel 
Nobel = Pulitzer
But whatever. 
Simple mistake. 
Emphasis on simple.4441",0,41,4,4,,,0,87
pulitzer,6:46 pm · 26 Apr 2020,Erik the Rural Juror@EDoggTheRed,"That this guy would tell you to drink bleach is literally the most believable thing ever. 

Noble->Nobel->Pulitzer?

(There were numerous more tweets referring to the reporter’s Noble prizes)37",1,7,3,,,,0,193
pulitzer,6:45 pm · 26 Apr 2020,Tom Fitton@TomFitton,"Replying to @realDonaldTrumpI know @JudicialWatch deserves the recognition but Pulitzer is a partisan, left-wing enterprise that wouldn't even let @JudicialWatch apply, while happily doling out prizes to leftist groups and fake news.Pulitzer Rep Tells Judicial Watch It ‘Does Not Qualify As A News Site’Nonprofit government watchdog's entries rejected, although the group routinely breaks major investigative stories about political corruption.dailycaller.com6282.9K7.7K",1,7.7K,628,2.9K,,"@realDonaldTrump,@JudicialWatch,@JudicialWatch",2,470
pulitzer,1:48 am · 25 Apr 2020,POLITICO@politico,"In today's episode of Punchlines, our Pulitzer Prize-winning cartoonist Matt @Wuerker and fellow artist Joel Pett talk about how they use clichés — in a non cringeworthy way — when illustrating the news of the day3:0119.9K views81860",1,60,8,18,,@Wuerker,0,233
pulitzer,12:35 am · 25 Apr 2020,Danielle Kurtzleben@titonka,Can we give KnowYourMeme a Pulitzer? Asking for all old people everywhere.3588,0,88,3,5,,,0,78
pulitzer,9:15 pm · 24 Apr 2020,POLITICO@politico,"“I have very little adult supervision,” says Matt Wuerker, POLITICO’s Pulitzer prize-winning staff cartoonist and resident curmudgeon. 

Go inside the wonderful world of Wuerker in this special episode of POLITICO Dispatch  https://politico.com/podcasts/dispatch…0:2215.5K views32366",1,66,3,23,,,1,283
pulitzer,7:35 pm · 24 Apr 2020,𝓛𝒐𝒊𝒔.@AstuteReporter,"𝑷𝑹𝑬𝑺𝑬𝑵𝑻𝑰𝑵𝑮...
➥︎ 𝗟𝗢𝗜𝗦 𝗟𝗔𝗡𝗘⠀⠀

     ✵︎ ˉ ∘  ˓  ﾟ   
                    the prestigious 
                    𝑫𝑨𝑰𝑳𝒀 𝑷𝑳𝑨𝑵𝑬𝑻 
                    reporter &amp; pulitzer 
                    prize awardee1:02476 views2432",1,32,,24,,,0,217
pulitzer,12:27 pm · 24 Apr 2020,POLITICO@politico,"Get to know Pulitzer Prize-winning cartoonist Matt @wuerker in our new video series, “Punchlines.”

In our second episode, Matt checks in with a Canadian cartooning buddy about humor in the time of coronavirus and the project #cartoonsagainstcovid3:2214.5K views71944",1,44,7,19,#cartoonsagainstcovid,@wuerker,0,267
pulitzer,11:31 am · 24 Apr 2020,noah  @Vozable,"Intriguing how @RonanFarrow refused to cover the #TaraReade allegations after he got a Pulitzer Prize for ending the predation of Harvey Weinstein. 

He’s now complicit in helping another rapist become the president. 

Ironically, not deserving the Pulitzer at all!41236",0,36,4,12,#TaraReade,@RonanFarrow,0,270
pulitzer,3:57 am · 24 Apr 2020,dfs player in the world@peteroverzet,this still should win a pulitzer41482,1,82,4,14,,,0,37
pulitzer,3:15 am · 24 Apr 2020,Tim Wu@superwuster,"This cameraman deserves a reaction shot Pulitzer, if there is such a thingQuote TweetPhil Williams@NC5PhilWilliams · 24 AprTake Camera 2Show this thread0:5021.4M views430118",1,118,4,30,,,0,173
pulitzer,3:12 am · 24 Apr 2020,AB/G@bibbygregory,"And speaking of Black fashion journalist, Robin Givhan has a fucking Pulitzer.121119",0,119,1,21,,,0,84
pulitzer,1:50 am · 24 Apr 2020,Laura Bradley@LAMBRADLEY,"Replying to @SethAbramsonSomeone on here said, ""The first reporter to yell out, 'WTF are you talking about?!?' should get a Pulitzer.""626301",0,301,6,26,,@SethAbramson,0,140
pulitzer,1:24 am · 24 Apr 2020,Nick Feik@NickFeik,A Pulitzer prize to the journalist who asks Trump to demonstrate it on live TV2969,0,69,2,9,,,0,82
pulitzer,1:23 am · 24 Apr 2020,Eric Umansky@ericuman,Give this shot a Pulitzer.Quote TweetDaniel Lewis@Daniel_Lewis3 · 24 AprHere is Dr. Birx's reaction when President Trump asks his science advisor to study using UV light on the human body and injecting disinfectant to fight the coronavirus.Show this thread0:5021.4M views1973271,1,271,19,73,,,0,278
pulitzer,11:31 pm · 23 Apr 2020,Christine Silva@ChristineS_1970,"@PhilipRucker is a Pulitzer Prize winning journalist, he’s paid his dues and earned his position #resepect Trump can not handle adversary questions, he is losing his shit. #Birx was speechless @mmckinnon @billmaher @chelseahandler @CNN #MSNBC @maddow @MaddowBlog #MAGA2:2033.1K views4452156",1,156,44,52,"#resepect,#Birx,#MSNBC,#MAGA","@PhilipRucker,@mmckinnon,@billmaher,@chelseahandler,@CNN,@maddow,@MaddowBlog",0,290
pulitzer,6:52 pm · 23 Apr 2020,Arts in the Armed Forces@AITAF,"With the announcement of the 2020 Bridge Award winner just one week away, we wanted to share more about this year's final selecting judge, David Henry Hwang - a Pulitzer Prize-winner, educator, mentor, and veteran theater artist.

http://aitaf.org/conversation-with-david-henry-hwang-2020-bridge-award-judge/…

(Photo by Brett Van Ort)Conversation with David Henry Hwang, 2020 Bridge Award JudgeGet to know the Head Judge for the 2020 Bridge Award, David Henry Hwang!   We can’t wait to announce ... Read Moreaitaf.org126192",1,192,1,26,,,3,524
pulitzer,5:42 pm · 23 Apr 2020,Parker Molloy@ParkerMolloy,"As Chicago media has been chipped away at and sold for parts, as Pulitzer winners have been put out of work and newsrooms shuttered, John Kass keeps making bank with his generic-brand right-wing pundit schtick. The least deserving media person in this city remains standing.212107",0,107,2,12,,,0,280
pulitzer,4:36 pm · 23 Apr 2020,Allison Harris@AllisonFox4News,"Retail to go begins tomorrow in Texas. @NorthParkCenter not allowing people inside, but allowing for curbside pick up at: David Yurman, Dillard’s, Finish Line, Game Stop, Lilly Pulitzer, Longchamp, Louis Vuitton, Neiman Marcus, Nordstrom, Saint Laurent, Williams Sonoma and more.122958",0,58,12,29,,@NorthParkCenter,0,285
pulitzer,2:52 pm · 23 Apr 2020,Dan Froomkin/PressWatchers.org@froomkin,"WH reporters are among Trump’s “most important enablers...  aiding and abetting Trump’s disinformation campaign,” writes Pulitzer-Prize winning former NYT reporter James Risen: https://theintercept.com/2020/04/22/trump-coronavirus-governors/…475150",1,150,4,75,,,1,248
pulitzer,2:23 am · 23 Apr 2020,Stephen L. Miller@redsteeze,"Would think NY Times Pulitzer journalists would have looked at this stuff before running their piece, I mean if they cared about a *actual journalism and not salacious palace intrigue.Quote Tweetjerylbier@JerylBier · 23 AprIn March, Rick Bright requested the FDA issue an ""Emergency Use Authorization (EUA) for emergency use of oral formulations of chloroquine phosphate and hydroxychloroquine sulfate for the treatment of 2019 coronavirus disease (COVID-19)..."" 
https://fda.gov/media/136534/download…Show this thread535131.2K",0,1.2K,53,513,,,0,527
pulitzer,10:29 pm · 22 Apr 2020,tariq panja@tariqpanja,"Story updated to reflect Benfica’s belated response - it denies any wrongdoing and suspects an international cabal of media, politicians and hackers were conspiring against the club. (Also said a Pulitzer awaits journalist who uncovers this great scandal)The Soccer Club as Sovereign StateJudges, prosecutors and even Portugal’s prime minister count themselves as Benfica supporters. But what happens when those fans are allowed to preside over cases that affect the club’s interests?nytimes.com3750259",1,259,37,50,,,2,502
pulitzer,8:39 pm · 22 Apr 2020,Abdel Jimenez@abdel1019,This year’s Pulitzer goes to this girl on TikTok.Quote TweetTaylor Lorenz@TaylorLorenz · 22 AprA TikTok investigation0:506.8M views238251,1,251,2,38,,,0,137
pulitzer,8:23 pm · 22 Apr 2020,Toby Turner@TobyTurner,"Snowden “Well, what I did won a Pulitzer Prize, the internet is more secure, u guys changed the law, & world is safer. Can i come back home & u guys not jail me for life w/o trial under 1917 espionage act?”
Gov “No. But if u come back, promise we won’t torture u”
Snowden, “lol.”710133",0,133,7,10,,,0,285
pulitzer,7:08 pm · 22 Apr 2020,Captain America@CaptainLives,"This photo won the Pulitzer.
A Cuban peasant land owner, who refused to work for the Castrista Regime, receiving his last rites from a priest, before he was executed on the orders of ""Che Guevara"".
You'll never see this picture on the t-shirt of a Liberal Marxist moron.59999",1,99,5,99,,,0,275
pulitzer,6:47 pm · 22 Apr 2020,@notbuaydubz,"Kendrick Lamar won a Pulitzer and y’all are comparing him to whom, exactly? See this why God don’t talk to us anymore.31036",0,36,3,10,,,0,123
pulitzer,6:28 pm · 22 Apr 2020,Paul Rudnick@PaulRudnickNY,"""The only truly postmodern artform is writing really long think pieces on social isolation, a new album, not bathing, giving yourself a haircut and Zoom. Next year's Pulitzer will be awarded to 300 pages on laundry and forgetting the day of the week"" - Libby Gelman-Waxner41385",0,85,4,13,,,0,277
pulitzer,5:58 pm · 22 Apr 2020,Jordan@JordanPlain,"Kendrick has a Pulitzer, if you think he bout to sit on IG while French play Pop That, you tripping.270133",0,133,2,70,,,0,106
pulitzer,5:24 pm · 22 Apr 2020,HemoJax@RedBrickz26,"Alex Thomson getting it tight from Celtic fans who want child rape to ""just go away.""

To think they were setting up a petition to get him the Pulitzer when he was digging into our troubles.Quote Tweetalex thomson@alextomo · 22 AprCFC response to rumours that Peter Lawell is threatening legal action against SFA over its draft report into historic sex abuse : « absolutely nonsense ».Show this thread22680",0,80,2,26,,,0,406
pulitzer,5:08 pm · 22 Apr 2020,cam@killacam250,"Give @Ann_Nwokoro an Oscar, Golden Globe, Pulitzer all that bc this story has me cryingggg2268",0,68,,22,,@Ann_Nwokoro,0,94
pulitzer,11:58 am · 22 Apr 2020,Brad Todd@BradOnMessage,"Virginia’s Gov. Ralph Northam has the latest end date on his shelter order in America. He’s in the bottom 5 on testing. He’s implying beaches wont even open in July. Is any bigtime journalist living in #NoVa ever gonna go for the Pulitzer under their nose?Ralph “No Hope” Northam — KERRY:If the governor keeps the beaches closed beyond June 10, it will be catastrophic. He has to stop moving the goalposts.kerrydougherty.com71425",1,25,7,14,#NoVa,,2,429
pulitzer,4:58 am · 22 Apr 2020,Eric Hu@_EricHu,Photography for example doesn’t seem to suffer from this. A cellphone picture from your dad of a trout he caught is allowed to exist in the same continuum as a Pulitzer Prize winning photograph and no one conflates the place of either of those things in the world3493,0,93,3,4,,,0,267
pulitzer,4:37 am · 22 Apr 2020,Leilani Münter@LeilaniMunter,"Looking forward to joining @SierraClub, @pluginamerica, @EAANational, @WSJ auto columnist and Pulitzer Prize winner Dan Neil & many more to talk all things electric cars tomorrow, live on Drive Electric Earth Day #DEED2020 April 22, 2pm ET/11am PT: http://sc.org/DEED2020FB #EffOil71267",1,67,7,12,"#DEED2020,#EffOil","@SierraClub,@pluginamerica,@EAANational,@WSJ",1,286
pulitzer,12:01 am · 22 Apr 2020,Tom D'Angora@TomDangora,"Whoever wrote this deserves a Pulitzer! 
#NYTough583275",1,275,5,83,#NYTough,,0,55
pulitzer,11:10 pm · 21 Apr 2020,john jackson@pvtjokerus,"Shep McCallum browbeating the Georgia Gov about....gyms. 

Pulitzer on the way.4274274",0,274,42,74,,,0,86
pulitzer,10:23 pm · 21 Apr 2020,Rick ★ ™@2020BlueTexas,"The very first reporter that stands up during his rallies and says “I can’t take these lies any longer!” and walks out, has my vote for the Pulitzer.29203988",0,988,29,203,,,0,157
pulitzer,10:14 pm · 21 Apr 2020,TheShipmanAgency@leslieleship,"The legendary @pswordwoman, finalist for a Pulitzer and an NBA, winner of the Kingsley Tufts, LA Times Book Prize, + NAACP Image Award, would like to talk to you about your poems. She's offering 3 different iterations. Info here: https://bit.ly/34RLcL01949",1,49,,19,,@pswordwoman,1,256
pulitzer,9:17 pm · 21 Apr 2020,John Edwin Mason@johnedwinmason," Can a political cartoon from South Africa win the Pulitzer Prize? If so, we have our winner. , @CarlosCartoons & @NewFrame_News.32863",0,63,3,28,,"@CarlosCartoons,@NewFrame_News",0,134
pulitzer,5:18 pm · 21 Apr 2020,Lucien@seyramxvi,Kendrick Lamar didn't become the first non-classical or -jazz artist to win Pulitzer Prize. A noble prize for that matter with his DAMN album for you to compare him to J Cole. Let's respect on this app.31480,0,80,3,14,,,0,207
pulitzer,1:14 pm · 21 Apr 2020,Room Rater@ratemyskyperoom,Doing all books? Use two walls. Not flat. Pulitzer material here. 8/10 @Eugene_Robinson2112743,1,743,21,12,,@Eugene_Robinson,0,94
pulitzer,2:20 am · 21 Apr 2020,Jim Hanson@JimHansonDC,"This tweet alone rates another Pulitzer

It's even better than the #TrumpRussia fail festQuote TweetMaggie Haberman@maggieNYT · 20 AprThe president, who is often criticized for fomenting anger in the country, says the press “foments anger.”51961",0,61,5,19,#TrumpRussia,,0,245
pulitzer,12:21 am · 21 Apr 2020,Jensen Karp@JensenKarp,Hand them the Pulitzer.Quote TweetNew York Post@nypost · 20 AprCan the coronavirus be spread through farts? https://trib.al/A3SdImX2030284,0,284,20,30,,,0,138
pulitzer,12:08 am · 21 Apr 2020,Marisa@MarisaLR2,"Replying to @maggieNYTMaggie, give back your Pulitzer!

Retweet to make this trend! 
#LiberalHack13597",0,97,1,35,#LiberalHack,@maggieNYT,0,102
pulitzer,11:14 pm · 20 Apr 2020,Dan Viner@grapevines87,"Replying to @maggieNYTHe is right!!
Give back your Pulitzer!!1890696",0,696,18,90,,@maggieNYT,0,68
pulitzer,9:54 pm · 20 Apr 2020,Donald Trump Jr.@DonaldJTrumpJr,"I guarantee you there’s not one retracted story, one retracted Pulitzer, and not one main stream “Russia Hoaxer” journalist who admits that they got it 100% wrong & who was really working with the Russians.

Because they’re not actually journalists, they’re leftist propagandists!Quote TweetArthur Schwartz@ArthurSchwartz · 15 AprTrump wasn’t working with the Russians. Steele and the Obama Administration were. Looks like the Brennan boys at the @nytimes & @washingtonpost who won Pulitzers got it all wrong. https://twitter.com/CBS_Herridge/status/1250526350768775172…6936.5K16.7K",0,16.7K,693,6.5K,,,0,582
pulitzer,8:58 pm · 20 Apr 2020,Sally Deal@SallyDeal4,"Replying to @SallyDeal4 and @realDonaldTrump Don't take medical advice from someone who claims windmills cause cancer.

 Don't take ANY advice from someone who said the National Enquirer deserved a Pulitzer Prize.

WaPo is rated HIGH for factual reporting. https://mediabiasfactcheck.com/washington-post/…

MBFC calls out BOTH sides.

end/34398",0,98,3,43,,"@SallyDeal4,@realDonaldTrump",1,344
pulitzer,7:51 pm · 20 Apr 2020,Lisa Abramowicz@lisaabramowicz1,"Best quote of the day: “The May crude oil contract is going out not with a whimper, but a primal scream,” said Daniel Yergin, a Pulitzer Prize-winning oil historian and vice chairman of IHS Markit Ltd.72998",0,98,7,29,,,0,206
pulitzer,5:40 pm · 20 Apr 2020,Kim Zetter@KimZetter,"A little good news among the bleak - @huibmodderkolk  my Dutch co-author on a story published last yr about Stuxnet tells me our piece was just nominated for the Dutch equivalent of a Pulitzer https://detegel.info/nominaties-2019/… Here's the English version of the storyRevealed: How a secret Dutch mole aided the U.S.-Israeli Stuxnet cyberattack on IranFor years, an enduring mystery has surrounded the Stuxnet virus attack that targeted Iran’s nuclear program: How did the U.S. and Israel get their malware onto computer systems at the highly secured...news.yahoo.com1779234",1,234,17,79,,@huibmodderkolk,3,577
pulitzer,5:16 pm · 20 Apr 2020,Valerie Schremp Hahn @valeriehahn,"Five years ago today, Robert and the @stltoday photographers won a Pulitzer Prize for breaking news photography.Quote TweetRobert Cohen@kodacohen · 20 AprSigning off for two weeks as I'm furloughed. Could be much worse. I'm healthy and returning to a job. Yet a bad time for any journalist not to be working. Please stay safe and take care of those around you. More than ever, please support your local newspaper. #JournalismMatters142105",0,105,1,42,,@stltoday,0,438
pulitzer,3:14 pm · 20 Apr 2020,J’aimerais mon loup @mon_coeur_gay,"I agree. It is worthy of a Pulitzer. It captures Trump's America perfectly. An educated, fit, aware health care professional vs. a crazy, unfit, unaware, slogan-wearing misfit cursing from a car window. It tells the story. Wisdom versus willful ignorance.Quote TweetBrandon Friedman@BFriedmanDC · 20 AprThis photo by @McclaranAlyson shows healthcare workers blocking protesters in Denver who were demanding the stay-at-home order be lifted. It's worthy of a Pulitzer.Show this thread82372",0,72,8,23,,,0,488
pulitzer,3:45 am · 20 Apr 2020,Jim Owczarski@JimOwczarski,"I work for The Milwaukee Journal-Sentinel, a Pulitzer Prize-winning and transparent pillar of the Fourth Estate. The standard is the standard. 

From the editors: No, an image at Brookfield rally was not doctored as false accusations on Facebook claimNo, a Journal Sentinel image of Confederate flag at Brookfield rally was not doctored, as false...The Journal Sentinel takes accusations like these seriously. This is not a doctored image. Here's what our investigation found.jsonline.com3686344",0,344,36,86,,,2,495
pulitzer,2:30 am · 20 Apr 2020,Maureen McGuire@MaureenMcGuire8,"Wouldn’t be surprised if this photo wins a PulitzerQuote TweetThe New York Times@nytimes · 20 AprHealthcare workers confronted people protesting stay-at-home orders in Denver and blocked their cars on Sunday, according to photojournalist Alyson McClaran.

""People were putting their cars right up against them,"" she said.
https://nyti.ms/2VlEfyF31594",0,94,3,15,,,0,350
pulitzer,1:39 am · 20 Apr 2020,Ashley Alexander@luxcompanionash,"I'm a savage (yeah)...

No. No you’re not.  You are a Lilly Pulitzer, sweet tea drinking, pie making, waist training, co*k loving southerner 3138555",0,555,31,38,,,0,148
pulitzer,1:00 am · 20 Apr 2020,History In Pictures@HistoryInPics,"When the Pulitzer Prize-winning film critic hated a movie, he didn't mince words.The following media includes potentially sensitive content. Change settingsView111798",0,98,11,17,,,0,166
pulitzer,10:35 pm · 19 Apr 2020,Mark R. Levin@marklevinshow,"Maggie Haberman, a New York Times Pulitzer-prize winner for her reporting on Russian; she's a modern-day Walter Duranty, another Times reporter who won a Pulitzer for his Russian propaganda nearly a century ago (as I explained in Unfreedom of the Press)Trump says New York Times reporter Maggie Haberman should 'give back' her Pulitzer PrizePresident Trump said New York Times White House correspondent Maggie Haberman should give back her Pulitzer Prize for her reports on Russia.washingtonexaminer.com1861.2K3.3K",1,3.3K,186,1.2K,,,2,514
pulitzer,9:42 pm · 19 Apr 2020,Chip Franklin@chipfranklin,"If they were just killing themselves it'd b sad, but they're killing you2. Can you imagine these f*ckKnuckles when we ask them to be vaccinated?

Join me 5pm-7pm PT Sunday show http://KGOradio.com w/ Pulitzer Journalist David Cay Johnston @DavidCayJ (5:30) It won't be boring30119278",1,278,30,119,,@DavidCayJ,1,283
pulitzer,5:45 pm · 19 Apr 2020,Daily Caller@DailyCaller,Trump Says NYT’s Maggie Haberman Should Return Her PulitzerTrump Says NYT’s Maggie Haberman Should Return Her PulitzerPresident Donald Trump said Saturday that New York Times reporter Maggie Haberman should return her Pulitzer Prize for reporting on possible Russian collusion.dailycaller.com40129481,1,481,40,129,,,2,300
pulitzer,3:06 pm · 19 Apr 2020,Pulitzer Center@pulitzercenter,"Did your college or university benefit from stolen Indigenous land? Join us on Tues, April 21, 2020 at 1:00 PM ET for a Talks @ Pulitzer webinar about the ""Land-Grab Universities"" investigation by @highcountrynews.Indigenous Lands and the Land-Grant University System: A Talks @ PulitzerJoin journalist Tristan Ahtone and historian Robert Lee for a virtual Talks @ Pulitzer digging into the Pulitzer Center-supported High Country News reporting project, multi-year investigation.pulitzercenter.org4252",1,52,,42,,@highcountrynews,2,501
pulitzer,2:15 pm · 19 Apr 2020,Max Weiss@maxthegirl,"This photo is Pulitzer worthy, @jmgpix618101",1,101,6,18,,@jmgpix,0,44
pulitzer,6:18 am · 19 Apr 2020,Backbone Radio@BackboneRadio,"Has NYT Maggie confirmed she's giving back that Pulitzer Prize?Quote TweetMaggie Haberman@maggieNYT · 18 AprHere’s the story the president just confirmed, saying Meadows may have shed tears for “other” reasons (the story didn’t say why).  https://nytimes.com/2020/04/16/us/politics/trump-mark-meadows-chief-of-staff.html…655176",0,176,6,55,,,0,327
pulitzer,3:15 am · 19 Apr 2020,Robert Patrick Lewis@RobertPLewis,"Pulitzer Prizes rescinded.

Let that sink in.

And remember how funny it is that they ask why we call them Fake News and Enemy of the People.234127",0,127,2,34,,,0,147
