Query,Date,user,Tweet,Img_present,Likes,commnets,retweet,tags,mentions,url_count,length
Pandemic,"5:36 PM · May 3, 2020","Mirza M Baig, MD@limrabaig",Thank you @SenToddYoung @sendavidperdue @SenatorDurbin @ChrisCoons for your inspiring leadership during the #COVID19 pandemic and recognizing the untapped potential of immigrant physicians. @WearePAHAQuote TweetDavid Perdue@sendavidperdue · Apr 30I just wanted to take a moment to say thank you to all the essential workers out there. We appreciate everything you're doing to help us get through this crisis.0:444.2K views1,1,1,,,#COVID19,"@SenToddYoung,@sendavidperdue,@SenatorDurbin,@ChrisCoons,@WearePAHA",0,423
Pandemic,"5:36 PM · May 3, 2020",Justice Seeker is sheltering at home @tizzywoman,"The question is, “Who do you want responding to a pandemic?”
I pledge to #VoteJoe. He respects science & has compassion for the people. 

Here’s page  A5 of today's @nytimes. #tRumpPandemic
#GoJoe36526742",0,742,36,526,"#VoteJoe,#tRumpPandemic,#GoJoe",@nytimes,0,204
Pandemic,"4:56 PM · May 3, 2020",Peter Hitchens@ClarkeMicah,"The flu of 1968-69 killed 80,000 in Britain,but there was no house arrest & the country didn't shut down: https://telegraph.co.uk/news/2020/05/02/britain-handled-1968-flu-epidemic-shutdown-avoided-second-wave/… 'Perhaps the 1968 pandemic did not prompt a worldwide economic shutdown because the generation in power had a more sanguine attitude towards diseases.How Britain handled the 1968 flu epidemic: Shutdown avoided, but second wave still struckWorldwide response to Asian flu was similar in many ways to Covid-19, except people went to work and lockdown was preventedtelegraph.co.uk2269241.7K",1,1.7K,226,924,,,3,598
Pandemic,"4:52 PM · May 3, 2020",Adnan Janjua@AdnanJanjua1603,"Punjab Chief Minister Usman Buzdar said he was calling in the military to help tackle the COVID-19 pandemic during the ongoing emergency situation.
#OurPride_PakArmy 196",0,6,,19,#OurPride_PakArmy,,0,169
Pandemic,"4:51 PM · May 3, 2020",Senator Bob Casey@SenBobCasey,"UN Secretary-General: ""As the pandemic spreads, it has also given rise to a second pandemic of misinformation, from harmful health advice to wild conspiracy theories. The press provides the antidote: verified, scientific, fact-based news.""

Thank you, journalists. #WorldPressDay2648280",0,280,26,48,#WorldPressDay,,0,286
Pandemic,"4:50 PM · May 3, 2020",Caity@caitlynadams11,We’re in a pandemic Siri5,1,5,,,,,0,25
Pandemic,"4:46 PM · May 3, 2020",Brad Penner@bradpenner2,My first half-marathon win today. First overall in the inaugural Mopac Half. The field was limited (to one) due to the pandemic. But I still am the champion!851,1,51,8,,,,0,160
Pandemic,"4:45 PM · May 3, 2020",Pop Crave@PopCrave,James Corden commits to paying the furlough salaries of around 60 staff on “The Late Late Show” out of his own pocket amid the COVID-19 pandemic.48393211.8K,1,11.8K,483,932,,,0,156
Pandemic,"4:40 PM · May 3, 2020",Dan Rather@DanRather,"A stunning and tragic early draft of history. So many jaw-dropping anecdotes. I suspect future historians will have even more evidence to work with and their judgement will be even harsher.34 days of pandemic: Inside Trump’s desperate attempts to reopen AmericaThough Trump remained fixated on reopening the economy, he and his administration fell far short of making that a reality.washingtonpost.com1321.3K4.8K",1,4.8K,132,1.3K,,,2,412
Pandemic,"4:38 PM · May 3, 2020",Kamala Harris@SenKamalaHarris,My new bill would create a COVID-19 Racial and Ethnic Disparities Task Force because this pandemic is highlighting deep racial disparities that have long existed in our country—and we need to act.Kamala Harris’s new bill would set up a task force to address racial disparities in coronavirus...The task force would advise FEMA and Congress on how to combat these inequities.vox.com2159974.3K,1,4.3K,215,997,,,2,391
Pandemic,"4:05 PM · May 3, 2020",Poynter@Poynter,"Today is #WorldPressFreedomDay. We salute the journalists and fact-checkers who pursue the truth without fear or favor. Especially during a pandemic, facts are life-saving.3107159",0,159,3,107,#WorldPressFreedomDay,,0,179
Pandemic,"4:02 PM · May 3, 2020",Chuck Callesto@ChuckCallesto,"BREAKING NOW: There is ""ENORMOUS EVIDENCE"" that the coronavirus pandemic originated in a laboratory in WUHAN, China....  - Mike Pompeo

WHERE DO YOU THINK IT CAME FROM?9962.9K6.9K",0,6.9K,996,2.9K,,,0,179
Pandemic,"3:57 PM · May 3, 2020",John Neary you@jddneary,6F living her best pandemic life892,0,92,8,,,,0,35
Pandemic,"3:54 PM · May 3, 2020",James Hayes@JamesHa32132517,"When it comes to deadly disease, vaccines are our best chance of protecting millions. @SpainMFA on May 4 will you help ensure no country has to face a pandemic alone by supporting @gavi to strengthen vaccine delivery systems across the world? Let’s #DefeatDiseaseTogether",0,,,,#DefeatDiseaseTogether,"@SpainMFA,@gavi",0,271
Pandemic,"3:51 PM · May 3, 2020",Chrystia Freeland@cafreeland,"A free and independent media is a cornerstone of liberal democracy. Today, on #WorldPressFreedomDay, let's thank the many brave journalists around the world who continue to seek and report the truth, without fear or favour, even amidst a global pandemic.7625502.5K",0,2.5K,762,550,#WorldPressFreedomDay,,0,264
Pandemic,"3:50 PM · May 3, 2020",احمد شجیع@ShajeehAhmad,#CallOffBoardExams We request you to cancel all board exams. Please END THIS 24/7 STRESS!! We’re not in situation to study. Everyone knows that this pandemic is not gonna end sooner or later!Do us a favour and cancel them!!!!!!#CallOffBoardExams @Shafqat_Mahmood @ImranKhanPTI42,0,2,,4,"#CallOffBoardExams,#CallOffBoardExams","@Shafqat_Mahmood,@ImranKhanPTI",0,278
Pandemic,"3:47 PM · May 3, 2020",Rastaman Hernandez@RastamanHernan1,"Dear @vsco @VSCO_support 
I’m a 7 years loyal customer. I have promoted you in my social media, I really love your app, but it really hurts my heart that during this hard times, during this pandemic you are the only company who isn’t giving nothing away. Do you really care?",0,,,,,"@vsco,@VSCO_support",0,274
Pandemic,"3:47 PM · May 3, 2020",walter c@waltcc82,"When it comes to deadly disease, vaccines are our best chance of protecting millions. @SpainMFA on May 4 will you help ensure no country has to face a pandemic alone by supporting @gavi to strengthen vaccine delivery systems across the world? Let’s #DefeatDiseaseTogether",0,,,,#DefeatDiseaseTogether,"@SpainMFA,@gavi",0,271
Pandemic,"3:46 PM · May 3, 2020",esha@esha_sarfraz11,We request you to cancel all board exams. Please END THIS 24/7 STRESS!! We’re not in situation to study. Everyone knows that this pandemic is not gonna end sooner or later!Do us a favour and cancel them!!!!!!#CallOffBoardExams @Shafqat_Mahmood @ImranKhanPTI65,0,5,,6,#CallOffBoardExams,"@Shafqat_Mahmood,@ImranKhanPTI",0,259
Pandemic,"3:44 PM · May 3, 2020","Andrew C Laufer, Esq@lauferlaw",Watched @FareedZakaria interview Peter Navarro this morning about #COVID__19 Navarro rightfully blamed China for the pandemic however he also blamed them for its impact her in the US which is wrong.  China has nothing to do with the Trump administration’s response to the virus 1/879249,0,249,8,79,#COVID__19,@FareedZakaria,0,286
Pandemic,"3:41 PM · May 3, 2020",Joel Franco@OfficialJoelF,"Beaches in Miami Beach will remain closed until COVID-19 cases decline. 

@MayorDanGelber: ""We know what'll happen if we open up our beaches: tens of thousands of people will come. We're not gonna rush into an exit of this pandemic."" https://wsvn.com/news/local/miami-dade/miami-beach-mayor-says-beaches-to-stay-closed-until-covid-19-cases-decrease/…134881.7K",1,1.7K,13,488,,@MayorDanGelber,1,359
Pandemic,"3:37 PM · May 3, 2020",Suzanne Trimel@STrimel,"Former Obama Nat’l Security Advisor Susan Rice on Trump’s stupid attempt at blaming Obama for this disaster:
Trump closed the pandemic tracking office & ripped up her pandemic playbook. Worse, he ignored warnings in Jan. & Feb.
1.1 million cases, 67k deaths are on him.
#AMJoy16120296",0,296,16,120,#AMJoy,,0,284
Pandemic,"3:33 PM · May 3, 2020",Lina Shitaye Zewdu@JoeExoticc,"Absolutely no one:
Isayas during this global pandemic:412160",1,160,4,12,,,0,60
Pandemic,"3:07 PM · May 3, 2020",your future @seblakachie,#FotoProfilBaru before pandemic,0,,,,#FotoProfilBaru,,0,31
Pandemic,"3:07 PM · May 3, 2020",Deeksha Thati@DeekshaThati,"@PMOIndia @narendramodi you very well know you cannot ‘Lift’ ban on flights in a pandemic. What’s your plan for stranded NRI’s in India? This anxiety is killing us #HelpNRIsReturnToUSA #SpecialFlightsQuote TweetAmrita Choudhury@amrita_c333 · 20hLockdown started with only 4Hrs notice. 43Days later, there's still NO PLAN to send NRIs back. I came for my mom's operation & have been stuck here since. All this while I've been away from my family living in US & my visa will expire soon.#HelpNRIsReturnToUSA
@ajitanjum202",0,2,,20,"#HelpNRIsReturnToUSA,#SpecialFlights","@PMOIndia,@narendramodi",0,519
Pandemic,"2:52 PM · May 3, 2020",Kerry Townsend Jacob@kerryfjacob,Let’s choose a leader who cares more about people during a pandemic than his election chances.  #GoJoe18157397,0,397,18,157,#GoJoe,,0,110
Pandemic,"2:52 PM · May 3, 2020",David Sirota@davidsirota,"By the time my parents were my age, the Dem Party had passed civil rights/voting rights laws & created Medicare/Medicaid.

In my 44 years, the Dem Party has cut welfare, deregulated Wall St, helped Trump bail out corporations during a pandemic & blocked the expansion of Medicare.1661.7K6.5K",0,6.5K,166,1.7K,,,0,291
Pandemic,"2:35 PM · May 3, 2020",Bill Kristol@BillKristol,"“We wasted two months denying it. We’re now wasting another two months by just dithering around.""34 days of pandemic: Inside Trump’s desperate attempts to reopen AmericaThough Trump remained fixated on reopening the economy, he and his administration fell far short of making that a reality.washingtonpost.com798702.7K",1,2.7K,79,870,,,2,318
Pandemic,"2:34 PM · May 3, 2020",Stephy@Stephynb,"Replying to @TyreeBPI just can’t stop thinking of this image - BLM +NAs protesters require mil grade equipment, weapons, tear gas, rubber bullets, +German Shepards but open up crowd doesn’t even require a mask made of fabric

This pandemic really is highlighting every injustice164953K",1,3K,16,495,,@TyreeBP,0,285
Pandemic,"2:33 PM · May 3, 2020",The New Yorker@NewYorker,"As the coronavirus pandemic continues—and misinformation emanates from the Trump White House—the need for reliable, widely-accessible information is more urgent than ever. #WorldPressFreedomDayThe Fate of the News in the Age of the CoronavirusCan a fragile media ecosystem survive the pandemic?newyorker.com14226497",0,497,14,226,#WorldPressFreedomDay,,2,315
Pandemic,"2:30 PM · May 3, 2020",Bloomberg Opinion@bopinion,"If one thing has united Americans during the coronavirus pandemic, it’s spring cleaning. 

The only problem? Thrift stores are informally reporting unprecedented volumes of donationsAt Overloaded Thrift Shops, Coronavirus Is Wreaking HavocA glut of donations and a lack of demand have left a crucial American industry reeling.bloomberg.com1408191.7K",1,1.7K,140,819,,,2,349
Pandemic,"2:21 PM · May 3, 2020",John Reynolds@SeanMac_R,"My piece for @tribunemagazine on the post-election/pandemic politics in Ireland over last couple of monthsHow Coronavirus Propped Up Ireland’s EstablishmentFebruary's election rocked Irish politics, with Sinn Féin breaking decades of right-wing duopoly to win the largest share of the vote. But in Ireland, as across the world, coronavirus has stalled the...tribunemag.co.uk3270",1,70,,32,,@tribunemagazine,2,378
Pandemic,"1:34 PM · May 3, 2020",Richard Angwin@RichardAngwin,"Good question :)

#Resist #Trump #1u #tcot #maga #kag #StayHome #pandemic #AMJoy #QAnon #NotMeUs #MichiganProtest61209474",0,474,61,209,"#Resist,#Trump,#1u,#tcot,#maga,#kag,#StayHome,#pandemic,#AMJoy,#QAnon,#NotMeUs,#MichiganProtest",,0,121
Pandemic,"1:26 PM · May 3, 2020",Abhishek Kesharwani@Abhishe32925805,"In this pandemic all intern doctors are contributing significantly by risking their lives at low stipend.UP Government is requested to increase their moral by increasing their stipend as other states
#coronawarriorsmbbsintern #raise_mbbs_intern_stipend
@myogiadityanath1228",0,8,1,22,"#coronawarriorsmbbsintern,#raise_mbbs_intern_stipend",@myogiadityanath,0,273
Pandemic,"1:25 PM · May 3, 2020",Evan Kirstel #StayHome #RemoteWork@evankirstel,A human car wash #pandemic #Covid_1987.8K views0:00 / 1:26From NowThis24249,1,49,2,42,"#pandemic,#Covid_19",,0,75
Pandemic,"1:25 PM · May 3, 2020",random.@thedeepestmsgs,can't wait to hug you when this pandemic is over291242,1,242,2,91,,,0,54
Pandemic,"1:23 PM · May 3, 2020",Lancé @lawskulprincess,"You would be here in a couple of hours if it werent for the pandemic. Ive been imagining picking you up at the airport since the day you left for UK. 
On the bright side, you beat covid19’s ass. Not a day goes by that i dont miss you, nang.14",0,14,,,,,0,242
Pandemic,"1:16 PM · May 3, 2020",عتیق الرحمان@The_Morbius_,"#WorldVsKashmirLockdown

Demonstrations in various parts of the world are now going on against lockdowns during a pandemic despite of medical, financial, communication & food assistance..!!
@The_Morbius_211",1,1,,21,#WorldVsKashmirLockdown,@The_Morbius_,0,206
Pandemic,"1:10 PM · May 3, 2020", علی@ihateubutistill,"Fighter jets showered petals on hospitals today. While we perform gimmicks,India might witness more deaths due to hunger than the pandemic itself.323",0,23,,3,,,0,149
Pandemic,"1:10 PM · May 3, 2020",The Daily Beast@thedailybeast,"One of those struggling with opioid addiction is Lynn, an Ohio resident. 

She hadn’t used opioids for three months, until one night in late March. As COVID-19 forced the country into lockdown, Lynn overdosed at her apartment.Don’t Forget the Other Pandemic Killing Thousands of AmericansAuthorities nationwide are reporting an uptick in fatal opioid overdoses during social distancing.thedailybeast.com64251609",1,609,64,251,,,2,411
Pandemic,"11:58 AM · May 3, 2020",Savage Lord Awon Titans@bukunmi101,"Tryna Trend My Queen
 & You're Telling Me To Obs Uganda & Nigeria Diss, 
You Are Mad In The Middle, 
@ This Pandemic,
Y'all Still Spreading Virus Of Hate Across Countries, 
Titans Don't Engage In It, Cuz  Tacha Stand For Africa.
#TheFutureIsTacha2219",0,19,,22,#TheFutureIsTacha,,0,250
Pandemic,"11:57 AM · May 3, 2020",Fijeeha@Fijeeha,"It’s raining in a lot of places in India, a good sign for #farmers.

On this #WorldLaughterDay, let’s redefine rain in our words & share a smile with each other in this amid #pandemic. 
 
#StayHomeStaySafe #LaughterDay2022",1,22,,20,"#farmers,#WorldLaughterDay,#pandemic,#StayHomeStaySafe,#LaughterDay",,0,222
Pandemic,"11:57 AM · May 3, 2020",John Pilger@johnpilger,"The UK Govt demands Britons download a phone app that ""traces the virus"". Australian PM Scott Morrison promotes a similar tool of mass surveillance. His adviser at WHO, Professor Mary-Louise McLaws, refuses. She warns the data will end up in the US. A digital pandemic is coming.3333.6K5.4K",0,5.4K,333,3.6K,,,0,290
Pandemic,"11:52 AM · May 3, 2020",StudentAnurag@AnuragStudent,"#EducationMinisterGoesLive @DrRPNishank @HRDMinistry Sir,
I am , ANURAG SINGH student of ARMY PUBLIC SCHOOL.
My question is -
What are the steps that would be taken by the ministry after the pandemic ,for the sake of the worthy students who are not capable for online learning?2",0,2,,,#EducationMinisterGoesLive,"@DrRPNishank,@HRDMinistry",0,278
Pandemic,"11:39 AM · May 3, 2020",Rosemary Lewis@JaRoJoCT1021,"#GoJoe #NationalTrumpTwitterBlackout 

My family and I support @JoeBiden 100% and all plan to vote to save our democracy and the people in November! Joe IS the one to lead us out of this pandemic and out of the darkness of the last 3 1/2 years!685471.2K",0,1.2K,68,547,"#GoJoe,#NationalTrumpTwitterBlackout",@JoeBiden,0,253
Pandemic,"11:31 AM · May 3, 2020",Julia Hartley-Brewer@JuliaHB1,"That’s weird. These comments from an *expert* about how the UK is handling the pandemic were made in a prominent BBC interview a few hours ago and yet for some reason they not yet reported on the BBC website. Can anyone help offer an explanation?Quote TweetGuido Fawkes@GuidoFawkes · May 3Head of the ONS: International Death Comparisons are Unbelievably Difficult, UK has Best, Most Transparent and Most Timely Reporting https://order-order.com/2020/05/03/head-ons-international-death-comparisons-unbelievably-difficult-uk-best-transparent-timely-reporting…6902.4K6.9K",0,6.9K,690,2.4K,,,0,569
Pandemic,"11:19 AM · May 3, 2020",Vikash Singh@VikashsinghVs,"Dear airtel 
It's very needful to work from home in the adverse pandemic situation but due to your worst network service from past week i can loose my job which is dreadful and i am not able to contact your customer services please help @airtelindia @help @TRAI214",0,4,2,1,,"@airtelindia,@TRAI",0,264
Pandemic,"11:17 AM · May 3, 2020",Lyna Bouacha@LynaBouacha,"When it comes to deadly disease, vaccines are our best chance of protecting millions. @SpainMFA on May 4 will you help ensure no country has to face a pandemic alone by supporting @gavi to strengthen vaccine delivery systems across the world? Let’s #DefeatDiseaseTogether",0,,,,#DefeatDiseaseTogether,"@SpainMFA,@gavi",0,271
Pandemic,"11:05 AM · May 3, 2020",xxabdullah@xxabdullah10,"#CallOffBoardExams
Keep tweeting until it gets to our PM @ImranKhanPTI
@FBISEOfficial 
Cancel karo board exams youth ko pandemic mai push kar rhey ab81",0,1,,8,#CallOffBoardExams,"@ImranKhanPTI,@FBISEOfficial",0,151
Pandemic,"11:01 AM · May 3, 2020",Joseph Pollara@JosephPollara,Amazon says the pandemic is over and is now time to get back to work. @realDonaldTrump @VP #MadeInAmerica #BacktoWorkAmericaQuote TweetCBS News@CBSNews · May 3Amazon is ending its unlimited time off policy for warehouse workers https://cbsn.ws/2KS6kr4,0,,,,"#MadeInAmerica,#BacktoWorkAmerica","@realDonaldTrump,@VP",0,251
Pandemic,"10:27 AM · May 3, 2020",कुलदीप कादयान@KuldeepKadyan,"Mohalla Clinics, the pilot project by Kejriwal Govt is proving to be such a boon to tackle this unforeseen pandemic. 
#KejriwalShowsTheWay3734",1,34,,37,#KejriwalShowsTheWay,,0,142
Pandemic,"9:33 AM · May 3, 2020",I-love-pak-army@Ilovepa24819918,"The governments of Balochistan and Punjab on Sunday sought the Pakistan Army's help in dealing with the coronavirus pandemic, asking it to assist civil institutions as the number of confirmed cases in the country crossed 600.
#OurPride_PakArmy2910",1,10,,29,#OurPride_PakArmy,,0,247
Pandemic,"9:25 AM · May 3, 2020",Indias Muslims@IndiasMuslims,"Everything's in a name!

UP Govt Names COVID-19 Hotspots After Mosques In Lucknow!!!

In a blatant attempt to communalise the coronavirus pandemic, state government in Uttar Pradesh has named eight out of 18 coronavirus hotspots in Lucknow after mosques!!!Yogi Adityanath Govt Names COVID-19 Hotspots After Mosques In LucknowIn a blatant attempt to communalise the coronavirus pandemic, the Yogi Adityanath government in Uttar Pradesh has named eight out of 18 coronavirus hotspots in Lucknow after mosques. Masjid Ali Jaan...thecognate.com34448632",1,632,34,448,,,2,548
Pandemic,"9:23 AM · May 3, 2020",sarwar@sarwarshabb,"Greatest B&D in the current race of boot kicking of modi government. 
Have you got no shame Mr @RajatSharmaLive 

Soon @SushantBSinha will tweet like this too.
Migrants paid extra in time of pandemic.Quote TweetRajat Sharma@RajatSharmaLive · May 3पिछले 70 साल में पहली बार किसी प्रधानमंत्री ने 40 दिन में मुख्यमंत्रियों से 4 बार बात की. 14 घंटे मशवरा किया. उनके कहने पर लॉकडाउन बढाया, मज़दूरों के लिए रेल चलाई. मु्ख्यमंत्री मानते हैं. फिर भी कुछ लोग कहते हैं केन्द्र राज्यों की नहीं सुनता. आखिर क्यों ?",0,,,,,"@RajatSharmaLive,@SushantBSinha",0,502
Pandemic,"9:20 AM · May 3, 2020",Caroline Lucas@CarolineLucas,"Note to #Marr - please stop allowing Grant Schapps to pretend it was reasonable for the Government not to stockpile gowns because they were preparing for a different kind of pandemic
There’s clear evidence that the government ignored expert advice - againUK government ‘failed to stockpile crucial PPE items’ ahead of coron…The UK government failed to include key items of personal protective equipment (PPE), such as gowns and visors, in its pandemic stockpile before coronavirus reached the UK, an investigation has found.independent.co.uk1532.1K5.2K",1,5.2K,153,2.1K,#Marr,,2,552
Pandemic,"9:17 AM · May 3, 2020",@Mvusto@mvusto,"When it comes to deadly disease, vaccines are our best chance of protecting millions. @SpainMFA on May 4 will you help ensure no country has to face a pandemic alone by supporting @gavi to strengthen vaccine delivery systems across the world? Let’s #DefeatDiseaseTogether",0,,,,#DefeatDiseaseTogether,"@SpainMFA,@gavi",0,271
Pandemic,"9:15 AM · May 3, 2020",Save the Children UK@savechildrenuk,"How do you stop the spread of #Coronavirus in a country ravaged by war? 

In Syria, we’re working with our partners to protect children and families against a pandemic that knows no borders.1:30844 views1525",1,25,,15,#Coronavirus,,0,207
Pandemic,"8:57 AM · May 3, 2020",Department of State@StateDept,"On #WPFD2020, the U.S. applauds the courageous work of journalists in supporting democracy and the free and transparent flow of information, especially during the #COVID19 pandemic. We call for the immediate release of journalists around the world imprisoned for their work.111306740",0,740,111,306,"#WPFD2020,#COVID19",,0,283
Pandemic,"7:35 AM · May 3, 2020",Er Sahil@sahilkumar_12,"#ServingTheNeedy 
Volunteers of Dera Sacha Sauda, are helping everyone around the nation to ease their pain due to global pandemic under the pious teachings of St Dr @Gurmeetramrahim Singh Ji Insan.
They are donating blood, distributing food, sanitizing cities, etc.19827",1,27,1,98,#ServingTheNeedy,@Gurmeetramrahim,0,271
Pandemic,"6:52 AM · May 3, 2020",Bradley Whitford@BradleyWhitford,Who knew managing a pandemic was harder than running a sleazy casino into bankruptcy?1712.4K18.1K,0,18.1K,171,2.4K,,,0,97
Pandemic,"6:41 AM · May 3, 2020",IMAM OF KARBALA@imamofkarbala,"BILL GATES  IS Exterminating
POPULATION BY TERR0RISM
VIRUSES GASES  LASERS  5G
CHIP INJECTI0NS VACCINES
M0SQUIT0ES AND TRICKING
THE PUBLIC INT0 BELIEVING
V are THE CAUSE 0F GLOBAL
WARMING HE IS USING 'cruel
BUREAUCRACY for HUNTING

BILL 'S pandemic plan 20 | 30
'll fuck u by chip1:23206 views11",1,11,,,,,0,295
Pandemic,"6:22 AM · May 3, 2020",ave@er77banker,"I'm afraid that Essential service providers will soon play a very essential role in spreading pandemic @ReutersIndia @DFS_India @FinMinIndia
#TestRedZoneBankers210157",0,57,2,101,#TestRedZoneBankers,"@ReutersIndia,@DFS_India,@FinMinIndia",0,166
Pandemic,"6:19 AM · May 3, 2020",202 CoBRA(Official)@cobra_202,"Jungle Warriors  202 CoBRA #CounterCovidCampaign/CAP. Educating and equipping villagers of Bhejji, Sukma, Chhattisgarh @fight CORONA pandemic.
@crpfindia111678",1,78,11,16,#CounterCovidCampaign,"@fight,@crpfindia",0,159
Pandemic,"6:16 AM · May 3, 2020",Hrishi roy@Hrishiroy12,"Unfortunate to hv dis Pandemic around us but fortune too 2 see de salute of Defence  2 Corona Warriors- de Docs,Nurses, Paramedical & cleaning Staffs, police,Corona survivors nd especially those who lost their lives
#FirMuskurayegaIndia #JitegaIndia @smritiirani @narendramodi",0,,,,"#FirMuskurayegaIndia,#JitegaIndia","@smritiirani,@narendramodi",0,276
Pandemic,"6:01 AM · May 3, 2020",TIME@TIME,"Loneliness is a modern invention. Understanding that history can help us get through this pandemicLoneliness Is a Modern Invention. Understanding That History Can Help Us Get Through This PandemicIt's important to remember that loneliness is not a universal human condition, but a historically specific onetime.com163901.1K",1,1.1K,16,390,,,2,323
Pandemic,"5:39 AM · May 3, 2020",CBS News@CBSNews,"More than 1,300 people in Rikers Island jail have tested positive for the virus — now released inmates are navigating life in the middle of a pandemic https://cbsn.ws/2W14ta937191262",1,262,37,191,,,1,182
Pandemic,"5:39 AM · May 3, 2020",SUVENDU MOHAPATRA@SUVENDUSNM,"Well done @ABPNews @aajtak @ZeeNews @republic 
But there are other journalists in LiarTheWire, FakeryPrint & AnDTV working tirelessly for masking & distorting the truth even during this pandemic!!!Quote TweetRajnish Ahuja@IamRajnishAhuja · May 3Salute to all Journalist friends who work tirelessly in these hard times.
@ABPNews #CoronaWillEndSoon #coronavirus #BeSafe #StayHomeSaveLives #WorldPressFreedomDay #ThankAJournalist1",0,1,,,,"@ABPNews,@aajtak,@ZeeNews,@republic",0,427
Pandemic,"4:35 AM · May 3, 2020",UN Women@UN_Women,"PM @jacindaardern is one of the women leaders praised for successfully managing the #COVID19 pandemic. 

Her leadership style, focused on empathy, hasn't just resonated with her people, but also put New Zealand on track for success against the #coronavirus.

#WomenInPolitics154751.3K",1,1.3K,15,475,"#COVID19,#coronavirus,#WomenInPolitics",@jacindaardern,0,284
Pandemic,"4:21 AM · May 3, 2020",Çançan @c15ma,"So, what will we do if this pandemic ends?114",0,4,1,1,,,0,45
