Query,Date,user,Tweet,Img_present,Likes,commnets,retweet,tags,mentions,url_count,length
Pandemic,"9:02 PM · May 1, 2020",Rev. Dr. William J. Barber II@RevDrBarber,".@UniteThePoor is urging people to ignore the deceptive orders from governors to return to a job that’s a possible death sentence & instead, stay inside & organize for a fight to save their lives during the #COVID19 pandemic. http://June2020.orgQuote TweetPoor People's Campaign@UniteThePoor · May 1They’ve lied about health care, racist voter suppression & tax cuts. We should not believe them when they say it’s time to open up. #COVID19

Stay in place! Stay alive! Organize, Organize, Organize! Join the #PoorPeoplesCampaign for 50 Days of Action: http://June2020.org255271K",0,1K,25,527,#COVID19,@UniteThePoor,1,577
Pandemic,"8:58 PM · May 1, 2020",The Secret Nurse@SecretPandemic,Surely we should be worried when #Gogglebox is the best journalism and social commentary we’ve had in this country for about 15 years.889706,0,706,8,89,#Gogglebox,,0,140
Pandemic,"8:56 PM · May 1, 2020",Carl T. Bergstrom@CT_Bergstrom,"My op-ed with @nataliexdean on herd immunity and overshoot is out in the @NYTimes.  

It's so short I won't do a thread on it; just take a look.

tl;dr—letting the pandemic sweep through until we reach herd immunity would be a humanitarian disaster.Opinion | What the Proponents of ‘Natural’ Herd Immunity Don’t SayTry to reach it without a vaccine, and millions will die.nytimes.com866661.3K",1,1.3K,86,666,,"@nataliexdean,@NYTimes",2,392
Pandemic,"8:53 PM · May 1, 2020",Ameerah@Ameerah09257343,"#Repost @IndomieNigeria (@get_repost)
・・・
Not all heroes have super powers to run like swifty or be as flexible as stretchy. But being forefront of a global pandemic, saving lives, is much more than any super power,… https://instagram.com/p/B_qMvT3JCo7/?igshid=15qjdgcr42iix…1",0,1,,,#Repost,"@IndomieNigeria,@get_repost",1,276
Pandemic,"8:53 PM · May 1, 2020",Lauren@cheer_chic1519,Supposed to be moving to Disney...pandemic changed that 130,0,30,,1,,,0,59
Pandemic,"8:50 PM · May 1, 2020",Jake Mysliwczyk@jake_mysliwczyk,The Duquesne Incline in #Pittsburgh displays signs as a reminder to protect ourselves during the COVID-19 pandemic.256209,1,209,2,56,#Pittsburgh,,0,121
Pandemic,"8:46 PM · May 1, 2020",Issa Rae@IssaRae,Replying to @makeupIadygirl talk to your pandemic and your presidentGIF23881.2K,1,1.2K,23,88,,@makeupIady,0,79
Pandemic,"8:02 PM · May 1, 2020",Laura Jean Baker@LauraJeanBaker,"These lions have guarded my library — your library, the PUBLIC library — since the day I was born, and they remain vigilant in the pandemic, masks & all 115",0,15,1,,,,0,156
Pandemic,"7:54 PM · May 1, 2020",Devonte Kelly@splashytae3,I've been blessed to make it past 2 open heart surgery procedures and now getting through this pandemic. They would send me a fast trak application to complete before any other student could apply.I'm at $34K in scholarships from them alone.4+1 program for Marketing! #DecisionDay215,0,15,2,,#DecisionDay,,0,283
Pandemic,"7:50 PM · May 1, 2020",Tom Newton Dunn@tnewtondunn,"Excl: Britain to start formal trade deal negotiations with the US next week despite the coronavirus pandemic. Trade Secretary Liz Truss and US Trade Representative Robert Lighthizer to lead the first round.Britain to start US trade talks next week with Donald Trump ‘desperate to do a deal’MINISTERS are to start trade deal talks with the US next week, The Sun can reveal. Downing Street has issued the order to commence the formal negotiation despite the coronavirus pandemic still ragi…thesun.co.uk165268774",1,774,165,268,,,2,509
Pandemic,"7:45 PM · May 1, 2020",Penny Baldwin-French@scoutkayaker,Replying to @zachjourno and @washingtonpostDoes that nit not realize the pandemic briefings aren’t a reality show?  And that we only tune in to see the orange dancing bear cavort himself into his next offensively stupid statements.539,0,39,,5,,"@zachjourno,@washingtonpost",0,234
Pandemic,"7:44 PM · May 1, 2020",CBS News@CBSNews,New report says coronavirus pandemic could last for two years – and may not subside until 70% of the population has immunity https://cbsn.ws/3aWsIKK86211362,1,362,86,211,,,1,156
Pandemic,"7:34 PM · May 1, 2020",KKP PEI@KKP_PEI,"We’d like to give a big shout out and thank you to all businesses and organizations that ordered our social distancing floor decals during our promotion.Together we raised $3,600 for PEI Food Banks to help those with food insecurity during the COVID-19 pandemic #strongertogether210",1,10,,2,#strongertogether,,0,282
Pandemic,"7:33 PM · May 1, 2020",#s386 Libertarian@IndusLibertari1,#s386 is critical for ensuring integrity of American immigration law. By opposing it @SenatorDurbin is making it difficult for immigrants and employersSenator Dick Durbin’s Racism hurts Immigrant Doctors fighting the pandemicXenophobia in USA is on serious rise ? Answer to that is well known. With a deeply racist President who has done everything in his power…medium.com13334,1,34,1,33,#s386,@SenatorDurbin,2,377
Pandemic,"7:33 PM · May 1, 2020",Rep. Val Demings@RepValDemings,Is it really so controversial to say that you should be able to vote by mail during a pandemic?1K6.3K36.8K,0,36.8K,1K,6.3K,,,0,106
Pandemic,"7:30 PM · May 1, 2020",Barbra Streisand@BarbraStreisand,Officially the USA has a third of the world's COVID-19 cases. The real number is far higher. Donald Trump will have a lasting legacy for the colossal failure of his response to this global pandemic and the thousands of possibly preventable deaths because of his incompetence.883832.2K,0,2.2K,88,383,,,0,284
Pandemic,"7:26 PM · May 1, 2020",Lydia Polgreen@lpolgreen,I have been watching and listening to @RaySuarezNews basically my whole life. This is heartbreaking.Perspective | I clung to the middle class as I aged. The pandemic pulled me under.Older Americans are about to learn how hard it is to stay afloat.washingtonpost.com29296723,1,723,29,296,,@RaySuarezNews,2,273
Pandemic,"7:01 PM · May 1, 2020",Emily Heathfield@Orignal_Darky,Sorry to everyone expecting and wanting lewd things during this pandemic I'm just very busy and so consumed with things that its hard to come back but I will try when I can until then take this pic of goth ass on me loves~114,0,14,1,,,,0,225
Pandemic,"6:56 PM · May 1, 2020",Penny Pandemic@Julia_aless1,This is the shit I live for I’m building up the Community24,0,4,2,,,,0,59
Pandemic,"6:49 PM · May 1, 2020",Power Lunch@PowerLunch,"NYU's ""Dean of Valuation"" @AswathDamodaran explains what the #coronavirus pandemic means for the @Airbnb IPO.4.9K views0:00 / 1:32913",1,13,,9,#coronavirus,"@AswathDamodaran,@Airbnb",0,133
Pandemic,"6:39 PM · May 1, 2020",Sara Eisen@SaraEisen,"Grocery inflation due to pandemic: In the past week, prices have risen for fresh meat by 8%, eggs by 31% cheese by 11% and cows milk by 10% versus this time last year via new numbers from @nielsen2018511.7K",0,1.7K,201,851,,@nielsen,0,206
Pandemic,"6:39 PM · May 1, 2020",Olivia Messer @OliviaMesser,"BREAKING: United has told employees that 15,000 workers will be reduced to part-time amid the pandemic. One baggage handler based in Houston told me the move is “disgusting” and a “slap in the face” after the company received money from the CARES Act.‘Stabbing Us in the Back’: United Airlines Cuts Worker Hours After Taking Relief FundsRep. Sheila Jackson Lee said this week the funds were not meant as “an economic bail-out” but “to support the hard-working men and women who are the faces of United Airlines.”thedailybeast.com32317497",0,497,32,317,,,2,537
Pandemic,"6:39 PM · May 1, 2020",The Nine@BBCScotNine,"Intensive Care Units are the front line of the coronavirus pandemic and from dusk until dawn their night shifts work while the world sleeps, keeping the most ill patients alive.

#TheNine's @chrisbobyn spent a 12 hour shift with the overnight ICU team at Hairmyres Hospital.3:425.6K views24390",1,90,2,43,#TheNine,@chrisbobyn,0,293
Pandemic,"6:38 PM · May 1, 2020",Abhisekh mohapatra@BeingAbhisekh,My sister is stuck in Dubai amid of the ongoing pandemic. Is there any provision to bring back the indians back to India? If yes please update us on that point. @cgidubai @DrSJaishankar,0,,,,,"@cgidubai,@DrSJaishankar",0,185
Pandemic,"6:37 PM · May 1, 2020",PL@psalmyl,"if you’re STILL hanging out with your friends in this pandemic, even if it’s in their house or in a private area!!!! you’re part of the problem!!!!!!9",1,9,,,,,0,150
Pandemic,"6:31 PM · May 1, 2020",Queen Misah@Hlumisamdiza,"The only thing that pains me,  people will be left Jobless after this Pandemic 53562",0,62,5,35,,,0,84
Pandemic,"5:32 PM · May 1, 2020",Kao@tmkrlvc,"Me praying for this pandemic to end:
#คั่นกูEP1167621.7K",1,1.7K,6,762,#คั่นกูEP11,,0,56
Pandemic,"5:32 PM · May 1, 2020",PBS NewsHour@NewsHour,"U.S. intelligence agencies conclude that the novel coronavirus was “not manmade or genetically modified,” but say they are still examining a notion put forward by the president that the pandemic may have resulted from an accident at a Chinese lab.U.S. intel concludes virus not manmade, still studying lab theoryU.S. intelligence agencies are debunking a conspiracy theory, saying they have concluded that the new coronavirus was ""not manmade or genetically modified."" But they say they are still examining a...pbs.org249654892",1,892,249,654,,,2,527
Pandemic,"5:30 PM · May 1, 2020","Ayendy Bonifacio, PhD@AyendyBonifacio","In the eye of this pandemic, we welcome this little ray of light, my niece, Isabella Bonifacio, to this strange world. 192204",0,204,19,2,,,0,125
Pandemic,"5:30 PM · May 1, 2020",NBC News@NBCNews,"There are thought to be just 16 lesbian bars left across the US, and the coronavirus pandemic could reduce the number even further. https://nbcnews.to/2VRQdAk - @NBCOUTFew lesbian bars remain in the U.S. Will they survive COVID-19?There are thought to be just 16 lesbian bars left across the country, and the global coronavirus pandemic could reduce the number even further.nbcnews.com4014498",1,98,401,44,,@NBCOUT,3,392
Pandemic,"5:29 PM · May 1, 2020",Elizabeth Warren@SenWarren,"President Trump has made it clear that he’s putting himself & his rich buddies first during this pandemic. @SenBlumenthal, @RepJayapal, @RepSarbanes, & I have laid out strong oversight & anti-corruption provisions for the next coronavirus relief package. https://warren.senate.gov/oversight/letters/blumenthal-warren-jayapal-and-sarbanes-lay-out-oversight-accountability-and-anti-corruption-provisions-for-next-congressional-covid-19-response-package…1459383.6K",1,3.6K,145,938,,"@SenBlumenthal,@RepJayapal,@RepSarbanes",1,461
Pandemic,"5:25 PM · May 1, 2020",Captain Mark Kelly@CaptMarkKelly,"On #InternationalWorkersDay, I want to thank the workers on the frontlines of this pandemic and the unions that are fighting to ensure frontline workers can do their jobs safely. When we focus on protecting workers and their rights, all Arizonans are better off for it.481296",0,296,4,81,#InternationalWorkersDay,,0,275
Pandemic,"5:21 PM · May 1, 2020",Movimiento Cosecha@CosechaMovement,"From the #MayDay2020 immigrant caravan in New Bedford, MA: Car decorations include a memorial for Jose Soler, a Cosecha Massachusetts leader who passed away from COVID-19.

Immigrant workers are not disposable in this pandemic. Everyone deserves dignity and protection!2840",1,40,,28,#MayDay2020,,0,273
Pandemic,"5:19 PM · May 1, 2020",Murtaza M. Hussain@MazMHussain,"Despite all the ""natural is healing"" commentary global CO2 emissions have not considerably declined during the pandemic. This suggests emission levels relate less to individual behavior than larger structural factors only addressable through regulation:Why CO 2 Isn’t Falling More during a Global LockdownThe answer lies in what sectors of the economy have shut down and expectations of recovery later in the yearscientificamerican.com262.4K4.5K",1,4.5K,26,2.4K,,,2,445
Pandemic,"4:44 PM · May 1, 2020",Mary Scott Hodgin@maryscotthodgin,"There is practically no broadband coverage in Perry County. 20% of students there have no internet access at all. That's made it difficult to continue learning (and working) from home.

In Rural Alabama, Pandemic Highlights Need For Broadband Access https://wbhm.org/feature/2020/rural-alabama-pandemic-highlights-need-broadband-access/… #WBHMIn Rural Alabama, Pandemic Highlights Need For Broadband Access | WBHM 90.3The internet is helping a lot of people get through the COVID-19 crisis. But many people in rural areas like the Black Belt have no internet access at all.wbhm.org359105",1,105,3,59,#WBHM,,3,587
Pandemic,"4:34 PM · May 1, 2020",Yankel Becker באר אשלג@barAshlag,Happening now: union construction workers go rogue on May Day - begin smashing job sites in retaliation against being forced to work during the Covid-19 pandemic. #directdemocracy0:062.2K views369208,1,208,3,69,#directdemocracy,,0,199
Pandemic,"4:33 PM · May 1, 2020",AFL-CIO @AFLCIO," @SpeakerPelosi gets it. Millions of people who have lost their jobs and millions more on the front lines of the #COVID19 global pandemic need our collective support and decisive action from Congress. #1u
Act now: https://actionnetwork.org/letters/a5ee?source=direct_link&referrer=group-afl-cio…1:1415.9K views59607985",1,985,59,607,"#COVID19,#1u",@SpeakerPelosi,1,318
Pandemic,"4:28 PM · May 1, 2020",H20@kunjhay29,"If you no see ur gf after this pandemic no be rapture, awa la capture.
She just couldn't resist the culture.31336",0,36,3,13,,,0,113
Pandemic,"4:27 PM · May 1, 2020",Caroline O'Donovan@ceodonovan,"It's May Day! Read my thoughts on the pandemic, groceries, mutual aid, and whether going ""back to normal"" is really what we wantPeople Want To Go Back To Normal. Delivering Pandemic Groceries Made Me Question Whether We Should.Volunteering to buy a neighbor's groceries during the coronavirus pandemic made me think hard about how we’ve always done things.buzzfeednews.com764341.3K",1,1.3K,76,434,,,2,381
Pandemic,"4:26 PM · May 1, 2020",Maybe: Chloe@chloeameliia,it took a whole pandemic but at least y’all know who your governor is!108278,0,278,,108,,,0,76
Pandemic,"4:25 PM · May 1, 2020",Justice Department@TheJusticeDept,"Q: #AskAGBarr If you've been the victim of a vile multi-state pandemic scam who do you file complaints with? The FTC? The F…
- @PJMcIlvaine

A: Report fraud to the Department of Justice’s National Center for Disaster Fraud at 866-720-5721 or http://justice.gov/DisasterComplaintForm…0:4518.5K views131583793",1,793,131,583,#AskAGBarr,@PJMcIlvaine,1,307
Pandemic,"3:54 PM · May 1, 2020",Neelesh PR@Neelesku,"The #coronavirus pandemic has exposed the lack of infrastructure, support, resources and care for daily labour, most of which are men.

Flexible work arrangements must be applied at all levels to support the economic security of every family. #AlwaysRespectLabour
@UNHumanRights93",1,3,,9,"#coronavirus,#AlwaysRespectLabour",@UNHumanRights,0,280
Pandemic,"3:54 PM · May 1, 2020",Pandemic at the Disco @RKSAlberta,"He said as he used a tragedy like this to push a political agenda. #cdnpoliQuote TweetPeter MacKay@PeterMacKay · May 1As a Nova Scotian, I am outraged that Justin Trudeau is using our tragedy to punish law-abiding firearms owners across Canada.

As Prime Minister, I can guarantee to all Canadians that I will never take advantage of a tragedy like this to push a political agenda.1:37773.2K views1455286",1,286,14,55,#cdnpoli,,0,404
Pandemic,"3:46 PM · May 1, 2020",ACLU@ACLU,"McDonald’s is the second largest private employer in the world. Its front-line employees face an impossible decision in the pandemic: Keep their jobs or maintain their health.

McDonald’s must provide paid leave for all workers. Sign the petition today.Tell McDonald's: Give Your Workers Paid Leave NowNo one should have to choose between endangering their health or losing a paycheck. Not in a pandemic, not ever. Add Your Name.action.aclu.org21327664",1,664,21,327,,,2,452
Pandemic,"3:45 PM · May 1, 2020",Robert Reich@RBReich,"Jeff Bezos has grown his fortune by $24,000,000,000 during this pandemic, but somehow can't afford to provide paid sick leave to all of his employees.

I spoke with striking Amazon workers — and had a few words for Mr. Bezos:1:3723.8K views639971.9K",1,1.9K,63,997,,,0,249
Pandemic,"3:45 PM · May 1, 2020",Joe@JoeSaunders,"Amanda Holden has released a cover of ‘Over The Rainbow’ for the NHS. Like the country going through a pandemic and a financial crisis wasn’t enough, NOW THIS? GIF134206",1,206,1,34,,,0,169
Pandemic,"3:37 PM · May 1, 2020",A @alexandruuuuh,"Me to my reviewers right now making 
pilit to understand the things I read  

Hassle to have exams during pandemic but laban to get that degree 6116",0,16,6,1,,,0,148
Pandemic,"3:31 PM · May 1, 2020",Health & Wellness@nshealth,"A big thank you to the province’s 2,400 practicising doctors on Doctors Day!! The dedication of physicians during the pandemic is much appreciated, and we are proud of the work you are doing! #NationalPhysiciansDay #DoctorsDay3171",1,71,,31,"#NationalPhysiciansDay,#DoctorsDay",,0,230
Pandemic,"3:29 PM · May 1, 2020",Delaney Brown@delaneybrown_,a note from a high school student during the coronavirus pandemic47,1,7,,4,,,0,67
Pandemic,"2:48 PM · May 1, 2020",Agent Gamer@XInsaneGamerX,"#TheNine there's many silver linings in this pandemic. In some places crime is low. Pollution low, everyday used to be school shootings, loved ones are together, we're being creative. Hang in there ppl. We are all in this together!!GIF114",1,4,1,1,#TheNine,,0,238
Pandemic,"2:48 PM · May 1, 2020","Adam B. Hill, M.D.@Adamhill1212","150k flamingos descend into urban Mumbai, India during the pandemic lockdown. 

 https://huffpost.com/entry/flamingos-mumbai-india-coronavirus-lockdown_n_5eaae1bfc5b634687cb46397…21599",1,99,2,15,,,1,184
Pandemic,"2:46 PM · May 1, 2020",Jared Yates Sexton@JYSexton,"White terrorists have already tried to bomb hospitals during the pandemic, discussed ways to weaponize the coronavirus, plotted murders. They are mobilizing because they see America in trouble and they have planned and trained and accrued arsenals for this moment we're in.

35/183521K",0,1K,18,352,,,0,285
Pandemic,"2:45 PM · May 1, 2020",Jared Yates Sexton@JYSexton,"In my research and other's research, we keep seeing them mentioning the pandemic and financial crisis as an opening to carry out their fascist overthrow. It's not a coincidence they're rearing their heads right now in shows of intimidation and force.

They see an opening.

34/293291.1K",0,1.1K,29,329,,,0,286
Pandemic,"2:38 PM · May 1, 2020",Rep. Eric Swalwell@RepSwalwell,"I stand with all of the grocery store clerks, janitors, delivery drivers, & essential workers striking today for safer working conditions. They’ve had our back throughout this pandemic & we ought to have theirs. Safety & security must come before corporate profits. #MayDay1861.5K7K",0,7K,186,1.5K,#MayDay,,0,282
Pandemic,"2:32 PM · May 1, 2020",Sar Haribhakti@sarthakgh,Can smart cloud people explain to me why AWS growth slowed down? I was convinced it would speed up. What are the reasons? A combination of AWS already being massive and Azure catching up? Shouldn’t the pandemic accelerate all the players?2026,0,26,20,,,,0,242
Pandemic,"2:32 PM · May 1, 2020",Park Elementary@MGUSC_Eagles,We can’t thank our cafeteria workers enough! You have been true heroes to our families through this pandemic! You are amazing!  #WeAreMG115,1,15,,1,#WeAreMG,,0,139
Pandemic,"2:31 PM · May 1, 2020",Mark Thomas@ESCOUTE1,Learn the 5 cybersecurity threats gaining ground during the #COVID19 pandemic in this new blog post:  https://bit.ly/3f5ISEP.35,1,5,,3,#COVID19,,1,127
Pandemic,"2:30 PM · May 1, 2020",Kamala Harris@SenKamalaHarris,"It's May 1, meaning rent and bills are due for millions who have lost their incomes. A single $1,200 check is not enough when bills come every month.

We must send people money every single month throughout the pandemic. It’s just common sense.4962K8.5K",0,8.5K,496,2K,,,0,253
Pandemic,"2:30 PM · May 1, 2020",Peter Obi@PeterObi,"Dear workers, as I felicitate with you on this special day, I am also aware that your members in the medical sector are in the frontline as our heroes saving lives amid the COVID-19 pandemic. #WorkersDay322181.2K",0,1.2K,32,218,#WorkersDay,,0,212
Pandemic,"2:16 PM · May 1, 2020",Jared Yates Sexton@JYSexton,"What you saw in Michigan yesterday wasn't a bunch of ""posers"" or ""gun nuts."" These are paramilitary separatists who are using the pandemic for their own benefit and carrying out dry runs for what they see as a fascist takeover of the US.

4/2261.1K2.8K",1,2.8K,226,1.1K,,,0,252
Pandemic,"1:55 PM · May 1, 2020",Vatican News@VaticanNews,"#PopeFrancis is urging everyone to pray the Rosary every day during the month of May, for an end to the #coronavirus pandemic. He has offered several prayers to help us:
 https://vaticannews.va/en/pope/news/2020-04/letter-on-the-month-of-may-full-text.html…9233624",1,624,9,233,"#PopeFrancis,#coronavirus",,1,264
Pandemic,"1:51 PM · May 1, 2020",Megan@Megan32176263,"Good morning..
#T.G.I.F 
#pandemic
#StayHome
5",0,5,,,"#T,#pandemic,#StayHome",,0,46
Pandemic,"1:49 PM · May 1, 2020",Nitansh Sachdev@NitanshSachdev,"Yes @Samanyu123, and I think it must be followed by each and everyone as a nation. BTW Thanks for the Updates! I look forward to PM @narendramodi to take good decisions so that we can surpass this pandemic situation. #StayHomeStaySafeQuote TweetSamanyu@Samanyu123 · May 1#LockdownExtended
#Lockdown3
#StayHome
#StaySafe1",0,1,,,#StayHomeStaySafe,"@Samanyu123,@narendramodi",0,320
Pandemic,"1:48 PM · May 1, 2020",Sonya Young@Syoungjba,"Please retweet this to show everyone how Covid-19 deaths are being recorded to inflate figure. 
New RELAXED guidelines for completing death certificates since pandemic, resulting in fraudulent death certificates7119106",1,106,7,119,,,0,218
Pandemic,"1:38 PM · May 1, 2020",Jasper Barry@JasperBarry2,"“One of the UK’s largest providers of care homes, which has lost more than 300 residents to Covid-19, has responded angrily to Boris Johnson’s claim the pandemic is on a downward slope, saying this is not true in care homes”UK coronavirus live: government changing how it counts tests to hit 100,000 target, report saysMajor care home provider criticises Boris Johnson and calls testing regime ‘shambolic’; deaths rise in Scotland, Wales and Northern Irelandtheguardian.com7465558",1,558,7,465,,,2,480
Pandemic,"1:36 PM · May 1, 2020",Gloria Felder-Evans@EvansFelder,Smiling during this pandemic is all apart of the survival of it all.14,1,14,,,,,0,70
Pandemic,"1:20 PM · May 1, 2020",NHS Surrey Heartlands CCG@SyHeartlandsCCG,"Vaccinations protect against serious illnesses, so it’s really important to keep up to date with jabs to help reduce pressures on the health service.
 
Your GP practice can help if you have any questions about attending appointments during the #COVID19 pandemic.

#HelpUsHelpYou71",1,1,,7,"#COVID19,#HelpUsHelpYou",,0,280
Pandemic,"12:51 PM · May 1, 2020",Taro@taro_taylor,"As time went by, more is known about the origin of the #COVID19 pandemic. It has now been established that the outbreak in France, Italy, Japan and the US, 4 of countries hardest hit by the virus, did not originate from China.Scientists find French outbreak strain did not come directly from ChinaResearchers conclude that the virus was circulating undetected in France in February, highlighting the difficulties facing governments trying to trace the source.scmp.com21415",1,15,2,14,#COVID19,,2,472
Pandemic,"12:49 PM · May 1, 2020",UK Column@ukcolumn,Dangerous man #BillGates. Here he's spreading more #covid19 fear coupled with new fear of 'bioterrorism'. Can he predict what's happening because he is helping drive the pandemic & finds that idea amusing? Yet he's @Conservatives @BorisJohnson virus guru (untrained unqualified)63365471,1,471,63,365,"#BillGates,#covid19","@Conservatives,@BorisJohnson",0,286
Pandemic,"12:47 PM · May 1, 2020",Dr. Roosy Aulakh@docroosy,Happy to be a contributor in framing guidelines for OPD practice in #COVID-19 pandemic era for #IAP Chandigarh....hope it serves its purpose.4222,1,22,4,2,"#COVID,#IAP",,0,145
Pandemic,"12:46 PM · May 1, 2020",afnandos@afnanhziq,"Aku tak menolak yang case akan naik bila PKPB ni dibuat, tapi nak buat mcm mana our country loss 2.4b a day sepanjang PKP, gov kena pilih loss of lives or loss in economic. We don't know when this pandemic will over, our country need to have revenue, we cannot feed anyone anymore163.9K2.8K",0,2.8K,16,3.9K,,,0,290
Pandemic,"12:40 PM · May 1, 2020",KWABA@kwaba_ng,"During this pandemic, millions of families face possible home eviction due to lack of rent payment. 

We need to keep the roofs over their heads. 

Please donate to help raise funds to shelter over 100 families http://paystack.com/pay/covid-19housingrelief…

Cc @RentCrowdy
#RENTRELIEF #StayHome34",0,4,,3,"#RENTRELIEF,#StayHome",@RentCrowdy,1,297
Pandemic,"12:40 PM · May 1, 2020",Thriller@mjfans4eva,Michael Jackson's son Prince hopes his dad would be 'proud' of his coronavirus pandemic response.132157,1,157,1,32,,,0,103
Pandemic,"12:39 PM · May 1, 2020",#wehaveaproblem@jojo497G,#WeWork is charging full membership fees & threatening collection action against members barred from using their workspace. This is hurting small biz around the world. WeWork should be mandated to shut down now & stop charging membership during this Pandemic. #wehaveaproblem39,1,9,,3,"#WeWork,#wehaveaproblem",,0,277
