Query,Date,user,Tweet,Img_present,Likes,commnets,retweet,tags,mentions,url_count,length,cosine_similarity(%)
pulitzer,7:45 pm · 19 Jan 2020,Mark Hamill@HamillHimself,"Another Highly Anticipated Book by two Pulitzer Prize-winning Washington Post reporters, has already proven to be a best-seller, to their great delight, all for the purpose of exposing a ""President"" who is demeaning and belittling our Country, at a record clip. You're welcome!Quote TweetDonald J. Trump@realDonaldTrump · 18 JanAnother Fake Book by two third rate Washington Post reporters, has already proven to be inaccurately reported, to their great embarrassment, all for the purpose of demeaning and belittling a President who is getting great things done for our Country, at a record clip. Thank you!1751.2K10.2K",0,10.2K,175,1.2K,,,0,619
pulitzer,6:43 pm · 19 Jan 2020,James Mitchell Ⓥ@MesMitch,"(THREAD) A Very Stable Genius review: dysfunction and disaster at the court of King Donald
Carol Leonnig and Philip Rucker, Pulitzer-winning Washington Post reporters, have produced a vital and alarming read242139196",0,196,242,139,,,0,216
pulitzer,4:30 pm · 19 Jan 2020,Abhinav Agarwal@AbhinavAgarwal,"I hope the article mentions a miracle of modern science, where 15 stitches on her forehead healed themselves in three days, leaving behind nary a scar or mark.
The doctor and his healing techniques are deserving of a Nobel in Medicine.
And the NY Times reporting a Pulitzer.Quote TweetJeffrey Gettleman@gettleman · 18 JanWhen a young Indian woman is attacked by goons, she doesn't turn into a victim. She turns into a hero. Aishe Ghosh. Read about her here: https://nyti.ms/2G1OgZq560131",0,131,5,60,,,0,487
pulitzer,1:34 pm · 19 Jan 2020,ScotsDefendAssange@ScotsDefend,"#ScotsDefendAssange

P L E A S E   W A T C H  >

The Julian #Assange case may set a dangerous precedent for the future of a free press. Six Pulitzer Prize winners explain this serious threat to the first amendment..Why the Julian Assange Case Threatens the Free Press | 6 Pulitzer...The Trump admin's charges against Julian Assange may lead to the death of the Free Press. Here's 6 Pulitzer Prize winners for outstanding journalism, who war...youtube.com24750",1,50,2,47,"#ScotsDefendAssange,#Assange",,0,459
pulitzer,1:25 pm · 19 Jan 2020,Hindu Americans@HinduAmericans,"Replying to @gettlemanA “hero?” Lol, are you a propgandist? You’re not a journalist. You’re a dumb colonial racist who thinks that by writing cute anecodtal ledes you will get another Pulitzer. Learn to write instead of showing off. Your whole persona and style is outdated hackery.45315",0,315,,45,,@gettleman,0,287
pulitzer,12:22 pm · 19 Jan 2020,Martin Pengelly@MartinPengelly,"“@PhilipRucker & @CarolLeonnig @washingtonpost offer A Very Stable Genius. As befitting Pulitzer winners for investigative reporting, it is richly sourced & highly readable, shedding light on how the 45th president tests the office…” 

cc @CarlosLozadaWPA Very Stable Genius review: dysfunction and disaster at the court of King DonaldCarol Leonnig and Philip Rucker, Pulitzer-winning Washington Post reporters, have produced a vital and alarming readtheguardian.com377227",1,227,3,77,,"@PhilipRucker,@CarolLeonnig,@washingtonpost,@CarlosLozadaWP",2,472
pulitzer,1:33 am · 19 Jan 2020,Paul T Murphy@Ptmurf1016,"Replying to @realDonaldTrumpYou're talking about,
A VERY STABLE GENIUS,
right ?
By Pulitzer Prize winning journalists.

Thanks for the recommendation,you encouraged me to pre-order,due out January 21.

A VERY STABLE GENIUS has incredible promise and I may have not ordered without your encouragement.
Thanks44296",1,96,4,42,,@realDonaldTrump,0,312
pulitzer,1:31 am · 19 Jan 2020,Mark Ames@MarkAmesExiled,Shorter: Lev Parnas says Firtash has a secret Internet cable connection to AlfaBank that Putin uses to spread dezinformatsiya kompromat on Joe Biden. If this bombshell doesn't win the Pulitzer—it means Putin has piss tapes on the Pulitzer Committee.The Kremlin Inches Closer to the Biden PlotLev Parnas pointed his finger at Dmytro Firtash.theatlantic.com34104250,1,250,34,104,,,2,363
pulitzer,3:43 am · 16 Jan 2020,CBC Docs@cbcdocs,"""I was in agony. Naked. So ugly. I wish that picture wasn’t taken."" Phan Thị Kim Phúc’s life changed forever when she became known as “the napalm girl” in a Pulitzer Prize-winning photograph.

She offers her Brief But Spectacular take on forgiveness and that girl in the picture.4:39715.1K views1983.5K8.5K",1,8.5K,198,3.5K,,,0,306
pulitzer,3:34 am · 16 Jan 2020,ItDidn’tHaveToBeThisWay@megan7oneill,Is there a Pulitzer Prize for journalism? How about an Emmy? #MaddowQuote TweetEleven Films@Eleven_Films · 16 Jan.@maddow is the best news anchor/reporter in America and has been for many years! Just amazing! #Maddow1964207,0,207,19,64,#Maddow,,0,223
pulitzer,3:30 am · 16 Jan 2020,Christine Lahti@ChristineALahti,Holy shit. Did @maddow just bring down @realDonaldTrump and win a Pulitzer? #Parnas #impeachment #WitnessesAndDocuments2535175,0,175,25,35,"#Parnas,#impeachment,#WitnessesAndDocuments","@maddow,@realDonaldTrump",0,126
pulitzer,3:17 am · 16 Jan 2020,ScarletThe Fiery Avenger Is Staying HomeFan@ScarletAvengers,"#DevinNunes is going down so hard, folks!

#LevParnas #Maddow #rachelmaddow #parnasinterview
@maddow 

IDK what’s the equivalent of a Pulitzer in TV broadcasting. Is it the Peabody? Excellence in broadcasting award?
Whatever it is, Rachel better get it for this interview724781.1K",0,1.1K,72,478,"#DevinNunes,#LevParnas,#Maddow,#rachelmaddow,#parnasinterview",@maddow,0,280
pulitzer,3:06 am · 16 Jan 2020,Jill Schuck@jill_schuck,Replying to @JoyAnnReid and @maddowPulitzer Prize work. Go Rachel. @maddow536476,0,476,5,36,,"@JoyAnnReid,@maddow,@maddow",0,80
pulitzer,3:05 am · 16 Jan 2020,cookiet9292@cookiet9292,Replying to @JoyAnnReid and @maddowYES!!! Rachel deserves a Pulitzer for this! She broke me down with the tea tonight! WHEW!937529,0,529,9,37,,"@JoyAnnReid,@maddow",0,130
pulitzer,2:47 am · 16 Jan 2020,11demo@11demo11,"Replying to @AngrierWHStaffRachel Maddow is the BEST!

What is the broadcast equivalent of a Pulitzer Prize - Edward R Murrow award? Anyway, she deserves one.517341",0,341,5,17,,@AngrierWHStaff,0,164
pulitzer,2:36 am · 16 Jan 2020,ThatDarnCat@NotDexVonFrisch,"We are watching Pulitzer Prize-level reporting tonight on 
#maddow35140977",1,977,35,140,#maddow,,0,74
pulitzer,12:00 am · 16 Jan 2020,IndieWire@IndieWire,.@HBO is currently in production on the first project of its multi-film deal with Pulitzer Prize-winning journalist Ronan Farrow. Details: http://bit.ly/2RnrGj9726,1,26,,7,,@HBO,1,163
pulitzer,10:06 pm · 15 Jan 2020,VANITY FAIR@VanityFair,"Pulitzer Prize-winning journalist @RonanFarrow has found the focus for his first HBO projectWith Ronan Farrow’s New Film, HBO Is All In on Reporters Under AttackBetween this and season two of Succession, we’re detecting a theme.vanityfair.com226118",1,118,2,26,,@RonanFarrow,2,248
pulitzer,8:03 pm · 15 Jan 2020,Gary Leising@GaryLeising,"All of Maura Quint’s debate recaps for @mcsweeneys have been brilliant; @behindyourback deserves a Pulitzer for this series. (& “facey-kicksy” should become a regular part of the political lexicon from here on out.Maura Quint’s Presidential Debate Recaps: The One Where Everyone Was Too Tired to Fight2020 DEMOCRATIC PRIMARY DEBATE DES MOINES, IOWA JANUARY 14, 2020 - - -9:00 PM: Wolf Blitzer opens the 7th Democratic primary debate in Iowa by remi...mcsweeneys.net517",1,17,,5,,"@mcsweeneys,@behindyourback",2,468
pulitzer,7:45 pm · 15 Jan 2020,The Last Word@TheLastWord,"Pulitzer Prize-Winning Journalist @WuDunn, co-author with her husband @NickKristof of the new book ""Tightrope,"" tells @AliVelshi that the narrative of personal responsibility over systematic inequality is fraught. https://on.msnbc.com/38aXrmk22567",1,67,2,25,,"@WuDunn,@NickKristof,@AliVelshi",1,247
pulitzer,7:36 pm · 15 Jan 2020,joseph patel@jazzbeezy,‘Told Virgil write “Brick” on my brick’ deserves a Pulitzer447107,0,107,4,47,,,0,65
pulitzer,7:30 pm · 15 Jan 2020,The Last Word@TheLastWord,"Pulitzer Prize-Winning journalists and married couple @NickKristof and @WuDunn discuss their new book, ""Tightrope,"" which looks at the impact of inequality on Kristof’s hometown in Oregon. https://on.msnbc.com/36XG7RA32065",1,65,3,20,,"@NickKristof,@WuDunn",1,222
pulitzer,6:36 pm · 15 Jan 2020,Veronica P Wolski @whaleswarrior,"I gave the ABC News Driver @StormIsUponUs #PatriotBracelet, asked him he knew about the Storm...
Mary Ann Ahern walks up, I give her a bracelet & told her ""If you did a story about QAnon, you'd win a Pulitzer Prize, do you know this? 
I had so much fun today.

#ThePeopleBridge1267441.8K",0,1.8K,126,744,"#PatriotBracelet,#ThePeopleBridge",@StormIsUponUs,0,287
pulitzer,4:00 am · 15 Jan 2020,abc730@abc730,"Cartoonist Pat Oliphant may be the most famous Australian you've never heard of. After moving to the United States in the early 1960s, Pat soon won the Pulitzer Prize and went on to become the most influential political cartoonist in the country. #abc7306:052.3K views21240",1,40,2,12,#abc730,,0,273
pulitzer,2:20 am · 15 Jan 2020,PragerU@prageru,"Should America be the world's policeman?

Does the world even need a policeman?

Or would humanity be better off if America weren't the dominant military superpower?

Pulitzer Prize-winning columnist and foreign affairs expert Bret Stephens weighs in.

#DemDebate5:197.3K views104794",1,94,10,47,#DemDebate,,0,283
pulitzer,2:06 am · 15 Jan 2020,PragerU@prageru,"Did George W. Bush lie to America about Saddam Hussein having weapons of mass destruction?

Judith Miller, a Pulitzer Prize-winning journalist, covered the lead up to the Iraq War for The New York Times, and settles once and for all the big lie about the war in Iraq.

#DemDebate5:4515.7K views1770103",1,103,17,70,#DemDebate,,0,301
pulitzer,1:52 am · 15 Jan 2020, grey-death shackleton @shackle_ton,"Whenever some shithole like college humour gets filled in, they always act as if every single person working there was a pulitzer prize winning gonzo journalist writing an expose on watergate and not making listicles of their top ten wokest poops as native advertising for condoms11448",0,48,1,14,,,0,285
pulitzer,12:34 am · 15 Jan 2020,Lisa Baginski@baginski_lisa,"Replying to @blakesmustache and @SethN12They weren’t alarmist when they said get out NOW. She did and THANK GOD.   And she STILL testified! #Pulitzer Peace prize material, putting her life on the line for World Peace.  OMG.34242",0,242,,34,#Pulitzer,"@blakesmustache,@SethN12",0,228
pulitzer,11:19 pm · 14 Jan 2020,Carrie Wittmer @carriesnotscary,every single podcast editor who has not edited out the part of a podcast where someone says “edit this out” deserves a Pulitzer2263,0,63,2,2,,,0,131
pulitzer,10:32 pm · 14 Jan 2020,Vs.@JFD8,"Replying to @dougmillsnyt, @Acosta and @realDonaldTrumpA Pulitzer to @dougmillsnyt for capturing a unicorn not pretending he doesn't need glasses.18109",0,109,1,8,,"@dougmillsnyt,@Acosta,@realDonaldTrump,@dougmillsnyt",0,151
pulitzer,2:34 pm · 14 Jan 2020,Real.Israeli@Real_Israeli,"Replying to @JamesOKeefeIIIBOMBSHELL!!!
O'Keefe deserves the pulitzer prize.  For real!1773",0,73,1,7,,@JamesOKeefeIII,0,91
pulitzer,12:20 pm · 14 Jan 2020,Angry Staff Officer@pptsapper,"Thus it ever was

Yellow journalism in the 1890s between Hearst and Pulitzer came about because it's what people bought

People *like* to feel shock and moral outrage. Often without considering the consequencesQuote TweetDavid B. Larter@DavidLarter · 14 JanI'm a big believer that we get the media we deserve. When people ask questions like ""why does the media x"" the answer is almost always ""You."" It's you, you click on bad news. You click on partisan tripe. You click on sensationalist garbage. That's why the media does ""x.""Show this thread32122509",0,509,32,122,,,0,552
pulitzer,7:50 am · 14 Jan 2020,Stanislas Dehaene@StanDehaene,"How far can the effects of distraction and multitasking take you?
All the way to unwillingly forgetting a child in a car for a whole day... it can happen to anyone.
A terrifying, eye-opening, Pulitzer-winning article.Quote TweetRachid l'instit@rachidowsky13 · 13 Jan1/Un article marquant et très bien écrit qui a reçu le Pulitzer en 2009

15 à 25 fois par an aux Etats-Unis, des enfants meurent d'hypothermie parce qu'ils ont été oubliés par un parent dans la voiture. Weingarten est allé à la rencontre de ces ""criminels""
https://washingtonpost.com/lifestyle/magazine/fatal-distraction-forgetting-a-child-in-thebackseat-of-a-car-is-a-horrifying-mistake-is-it-a-crime/2014/06/16/8ae0fe3a-f580-11e3-a3a5-42be35962a52_story.html?noredirect=on…Show this thread1936",0,36,1,9,,,0,761
pulitzer,6:24 am · 14 Jan 2020,Poseur@ATVSPoseur,"LSU Press has won 4 Pulitzer Prizes and a National Book Award. The Southern Review is one if the finest college literary magazines in the US. 8 Nobel Prizes are tied to LSU, including for 2019 Economics Award.

Oh yeah, and go fuck yourself, you sneering, elitist prick.Quote TweetBinyamin Appelbaum@BCAppelbaum · 14 JanDo the Warren/Sanders ""free public college"" proposals include LSU, or would it only apply to actual schools?Show this thread715117",0,117,7,15,,,0,450
pulitzer,11:00 pm · 13 Jan 2020,Oluwatosin Adeshokan@theOluwatosin,"Apparently I have a Pulitzer Centre page all to myself. 
Pretty cool 2020 if you ask me.521",0,21,,5,,,0,91
pulitzer,9:55 pm · 13 Jan 2020,jay snow ❅@houseofhastings,"if lex is good, does that mean kara never won the Pulitzer because that’s unacceptable514126",0,126,5,14,,,0,92
pulitzer,9:46 pm · 13 Jan 2020,Jesse Brown@JesseBrown,"5 yrs ago the Pulitzer-prize winning reporter @wherewarlives quit his job at @TorontoStar after he was forbidden to pursue a story.

We covered this in 2015, and then the whole thing kinda disappeared.

I wanted an update. What I got was a whole new story.#309 A War Reporter’s Newsroom BattlesWhy did the Toronto Star try to stop Paul Watson from reporting on a story?canadalandshow.com1127",1,27,,11,,"@wherewarlives,@TorontoStar",2,391
pulitzer,8:58 pm · 13 Jan 2020,The Hollywood Reporter@THR,"Pulitzer Prize-winning playwright, screenwriter and director David Mamet shared the secret behind his trademark rapid-fire dialogue on the latest episode of the #ItHappenedInHollywood podcast. Listen: http://thr.cm/LnjFlZ11951",0,51,1,19,#ItHappenedInHollywood,,1,226
pulitzer,7:57 pm · 13 Jan 2020,Charlie Sykes@SykesCharlie,"On today's @BulwarkOnline podcast, Pulitzer Prize winning historian Edward Larson joins me to discuss checks and balances discuss the Trump administration's radical expansion of executive power...The Bulwark Podcast: Edward Larson on Checks and Balances.On today's Bulwark podcast, Edward Larson joins host Charlie Sykes to discuss his recent item on the Trump administration's radical expansion of executive power and how it beckons what the founders...podcast.thebulwark.com942126",1,126,9,42,,@BulwarkOnline,0,482
pulitzer,7:50 pm · 13 Jan 2020,lil yhonkervix @BoyslnBIue,give @Jomboy_ the Pulitzer2843,0,43,2,8,,@Jomboy_,0,30
pulitzer,5:50 pm · 13 Jan 2020,Jency Jacob@jencyjac,"The Pulitzer award for the most tenacious reporting needs to go to this reporter. Good job @ndtvindia @ndtv @ndtvvideos #MaineAapkoJawaabDeDiyaHainQuote TweetNDTV Videos@ndtvvideos · 13 JanBJP नेता किरीट सोमैया का NDTV को अजीबो-गरीब जवाब

#KiritSomaiya #BJP4:161.1M views5938",1,38,5,9,#MaineAapkoJawaabDeDiyaHain,"@ndtvindia,@ndtv,@ndtvvideos",0,275
pulitzer,5:38 pm · 13 Jan 2020,Melissa Jo Peltier@MelissaJPeltier,"Our friend, the Pulitzer-winning, multi-talented journalist-author writes mysteries & thrillers w/wonderful characters & a literary flavor.

Check him out, you’ll love him!Quote TweetBryan Gruley@BryanGruley · 13 JanTomorrow my new novel, PURGATORY BAY, comes out. But first, a tribute to my late Mom from the book’s acknowledgments. She was my first fan. ⁦@AmazonPub⁩3832",0,32,3,8,,,0,372
pulitzer,8:14 pm · 10 Jan 2020,Brett McCracken@brettmccracken,"Pulitzer should invent a new category for best obituary and award it posthumously to Ken Fuson.View Ken Fuson's Obituary on DesMoinesRegister.com and share memoriesKen Fuson Ken Fuson, born June 23, 1956, died Jan. 3, 2020 in at Nebraska Medical Center in Omaha, of liver cirrhosis, and is stunned to learn that tlegacy.com1577",1,77,,15,,,2,327
pulitzer,4:37 pm · 10 Jan 2020,the villain at the end of this draft@arjetton,"Replying to @greg_doucetteIn all seriousness, @dailytarheel should submit their reporting for Pulitzer consideration. The tenacity of their reporting on this story has been incredible.2791",0,91,2,7,,"@greg_doucette,@dailytarheel",0,188
pulitzer,4:32 pm · 10 Jan 2020,Roy Peter Clark@RoyPeterClark,"Not worthy of a Pulitzer Gold Medal, but my stories  persuaded St. Petersburg City Council yesterday to officially adopt the brown pelican as the City's bird.  To which I cheer:  ""A wonderful bird is the pelican/His bill will hold more than his belican.""St. Petersburg makes the brown pelican the official city birdThe Brown Pelican was endangered in the 1980s. Now it’s numbers are steady, but threats still exist around the Tampa Bay area.tampabay.com3537",1,37,3,5,,,2,457
pulitzer,4:53 am · 10 Jan 2020,Kirsten Fleming@KirFlem,"Reporter Ken Fuson (who I never heard of til now, which is a damn pity) wrote his own obit. It’s a masterpiece molded w humanity, humility and humor. “no he didn’t win a Pulitzer Prize, but he’s dead now so get off his back.” RIP, Mr FusonView Ken Fuson's Obituary on DesMoinesRegister.com and share memoriesKen Fuson Ken Fuson, born June 23, 1956, died Jan. 3, 2020 in at Nebraska Medical Center in Omaha, of liver cirrhosis, and is stunned to learn that tlegacy.com1386265",1,265,13,86,,,2,474
pulitzer,12:47 am · 10 Jan 2020,Red Nation Rising@RedNationRising,"""They (media) write things that they know are wrong and then they get Pulitzer prizes."" -DJT11654",0,54,1,16,,,0,97
pulitzer,12:43 am · 10 Jan 2020,Steve Herman@W7VOA,"""The Pulitzer Prize doesn't mean a thing,""  says @POTUS.
""I made a deal. I just saved a country. Now I hear the head of the country is getting the Nobel Peace Prize. ... I saved a big war. I saved a couple of 'em.""82047",0,47,8,20,,@POTUS,0,219
pulitzer,6:23 pm · 9 Jan 2020,FFRF@FFRF,"""If the First Amendment’s Establishment Clause means anything, it has to mean that God’s will cannot be a constitutional justification for a law that erases an individual right."" -Pulitzer Prize-winning journalist Linda Greenhouse33485",1,85,3,34,,,0,235
pulitzer,5:34 pm · 9 Jan 2020,Annah Backstrom Aschbrenner@AnnahBackstrom,"""No, he didn't win a Pulitzer Prize, but he's dead now, so get off his back."" The legendary Ken Fuson wrote his own obit and it's just lovely. What a gift.Ken Fuson Obituary - -, IA | the Des Moines RegisterKen Fuson Ken Fuson, born June 23, 1956, died Jan. 3, 2020 in at Nebraska Medical Center in Omaha, of liver cirrhosis, and is stunned to learn that the world is somehow able to go on without him. Kenlegacy.com615472.1K",1,2.1K,61,547,,,2,425
pulitzer,5:34 pm · 9 Jan 2020,Matt Bors@MattBors,Just issue the 2020 Pulitzer in cartooning now.Quote TweetAbsurd Conservamemes@delusionalcons · 9 Janspoiler alert: he didn't join Islam1846663,0,663,18,46,,,0,143
pulitzer,3:48 pm · 9 Jan 2020,Michael Krieger@LibertyBlitz,"Give this paper a PulitzerQuote TweetThe Washington Post@washingtonpost · 9 JanAnalysis: The 1% are much more satisfied with their lives than everyone else, survey finds https://wapo.st/2Nakiqa31672",0,72,3,16,,,0,198
pulitzer,3:29 pm · 9 Jan 2020,Bill Weir@BillWeirCNN,"If you loved the Pulitzer-winning novel ""The Overstory,"" you'll love this: More than 8,500 donors from all 50 states chipped in to buy and protect one of the last groves of giant sequoiasGroup raises nearly $16 million to buy Alder Creek giant sequoia groveThe largest private holding of the world’s largest trees will be preserved after Save the Redwoods League raised millions in four months.latimes.com13292",1,92,1,32,,,2,410
pulitzer,2:09 pm · 9 Jan 2020,April@ReignOfApril,"Nah, put this headline in the Hall of Fame. Somebody contact the Pulitzer people. Quote TweetBossip@Bossip · 9 JanRed And White Me Down: Boosie BadAzz Wore A Kappa Alpha Psi Sweater To The Hawks Game And Got Shimmy Twitter's Brunch Boots In A Bunch 

[Getty]

https://bossip.com/1827360/yo-yo-mayne-boosie-wore-a-kappa-alpha-psi-sweater-to-an-nba-game-and-shimmy-twitter-is-losing-its-damned-mind/…636175",0,175,6,36,,,0,404
pulitzer,12:00 pm · 9 Jan 2020,The Varsitarian@varsitarianust,"Pulitzer Prize winner and former Reuters correspondent Manuel Mogato urged campus journalists to be fair, accurate and free of bias to keep journalism alive during the “fake news” era.‘In era of fake news, be faithful to journalism principles,’ Pulitzer winner tells campus journosPulitzer Prize winner and former Reuters correspondent Manuel Mogato urged campus journalists to be fair, accurate and free of bias to keep journalism alive during the ""fake news"" era.“If you wivarsitarian.net2538",1,38,,25,,,2,494
pulitzer,12:40 am · 9 Jan 2020,Sam Sanders@samsanders,"We need a Pulitzer Prize for headline writing. Bossip should get the first one. And every single one after that.Quote TweetBossip@Bossip · 8 JanBye Buckingham, Bye British Bigots, Bye Bulls***! Meghan Markle & Harmonious Hubby Harry 'Stepping Back' From Royal Family, Clotted Cream Critics Cry Foul https://wp.me/p2nLn-7Fkw

(Chris Jackson / Getty)202052.5K",0,2.5K,20,205,,,0,357
pulitzer,11:00 pm · 8 Jan 2020,Ralph Nader@RalphNader,The Washington Post's @geoffreyfowler deserves the Pulitzer Prize for his deep and groundbreaking features on the massive invasion of privacy largely unknown to consumers using the latest gadgets. -R334110,0,110,3,34,,@geoffreyfowler,0,205
pulitzer,9:15 pm · 8 Jan 2020,Jellenne@jellen805,"Ok, I'll say it out loud. 
@TheBabylonBee deserves a PULITZER PRIZE.722105",0,105,7,22,,@TheBabylonBee,0,74
pulitzer,3:12 pm · 7 Jan 2020,Karim Sadjadpour@ksadjadpour,"3. For starters, most Iranian Kurds-who make up 10% of the population-are not mourning Soleimani, given (like many IRGC commanders) he began his career in the early years of the revolution violently suppressing them. This is a Pulitzer Prize winning photo of what it looked like6170312",1,312,6,170,,,0,285
pulitzer,1:52 pm · 7 Jan 2020,Old Man With A Pen #TheGreatAmericanComeback@ScottHendrick49,"NYT's Tom Friedman Pulitzer Prize Winner and Trump Critic: ""One day they may name a street after President Trump in Tehran."" He called Soleimani possibly the dumbest man in Iran & most overrated strategist in the Mideast.As press questions intel, an unlikely voice blames Soleimani’s stupiditySeventeen years after the press rolled over for faulty intelligence on Iraq, journalists are training a harsh spotlight on disputed intelligence on Iran.foxnews.com2830",1,30,,28,,,2,461
pulitzer,8:58 pm · 6 Jan 2020,Benjamin Wash Your Fkn Hands & Stay TF Indoors Law@mrbenjaminlaw,"Epic US literary stars are now auctioning books for #AuthorsForFireys!

@CherylStrayed Leather-bound copies x Wild

@minjinlee11 Signed copies x Pachinko

@viet_t_nguyen Pulitzer ed x The Sympathizers

@rebeccamakkai Signed copies x The Great Believers

VISIT THEIR ACCOUNTS & BID368111",1,111,3,68,#AuthorsForFireys,"@CherylStrayed,@minjinlee11,@viet_t_nguyen,@rebeccamakkai",0,286
pulitzer,1:27 am · 6 Jan 2020,Adam H. Johnson@adamjohnsonNYC,"NYT editor: what’s your source here Dave?

Dave: Top Democrats 

NYT editor: hum. You say TOP Democrats?

Dave: absolutely. Very much top

NYT editor: how top?

Dave: the most top, very high on top

NYT editor:

Dave:

NYT editor: submitting this for a Pulitzer839337",0,337,8,39,,,0,267
pulitzer,8:55 pm · 5 Jan 2020,William Joseph Hellmann@w_j_hellmann,"When my friends and family ask me where I see my future going as a gay conservative author, I tell them ""I see a Pulitzer.""

Thanks to @Explosm for everything you guys do. In this harsh world, we need people like you who will joke about literally anything. 21196",0,96,2,11,,@Explosm,0,262
pulitzer,8:06 pm · 5 Jan 2020,Tommy Vietor@TVietor08,This guy got a Pulitzer Prize for commentary.1636541,1,541,16,36,,,0,52
pulitzer,5:06 pm · 5 Jan 2020,History Lovers Club@historylvrsclub,Jhumpa Lahiri's writing room. Pulitzer Prize-winning author's apartment in Rome. By John Spinks for the NY Times. See more images here: http://cmore.pics/w1BeA229,1,29,,2,,,1,162
pulitzer,4:53 pm · 5 Jan 2020,anarchoshoggoth@Dedbelly,Replying to @june_birnieIf I hear one more metal bro say they think hip hop is shallow but they like TPaB because Kendrick won a Pulitzer my head will explode.325790,0,790,3,25,,@june_birnie,0,165
pulitzer,6:17 am · 5 Jan 2020,cap’n watsisname@capnwatsisname,"I can finally announce that I’m a finalist for the Pulitzer in retweeting!

Wouldn’t be possible without the team of scientists, interns and lawyers running my account. I share this with them.1417",0,17,1,4,,,0,196
